[
  {"id":"commercial-001","chapter":1,"stem":"有限责任公司股东对外转让股权，需要：","options":["A.经全体股东同意","B.经其他股东过半数同意","C.经2/3以上股东同意","D.不需要其他股东同意"],"answer":"B","analysis":"股东向股东以外的人转让股权，应当经其他股东过半数同意。","isKey":true},
  {"id":"commercial-002","chapter":1,"stem":"股份有限公司发起人持有的本公司股份，自公司成立之日起多长时间内不得转让？","options":["A.6个月","B.1年","C.2年","D.3年"],"answer":"B","analysis":"发起人持有的本公司股份，自公司成立之日起1年内不得转让。","isKey":true},
  {"id":"commercial-003","chapter":2,"stem":"有限合伙企业中，有限合伙人对企业债务承担：","options":["A.无限责任","B.无限连带责任","C.有限责任","D.按份责任"],"answer":"C","analysis":"有限合伙人以其认缴的出资额为限对合伙企业债务承担责任。","isKey":true},
  {"id":"commercial-004","chapter":2,"stem":"普通合伙企业的合伙人对企业债务承担：","options":["A.有限责任","B.无限连带责任","C.按份责任","D.不承担责任"],"answer":"B","analysis":"普通合伙人对合伙企业债务承担无限连带责任。","isKey":true},
  {"id":"commercial-005","chapter":3,"stem":"个人独资企业的投资人对企业债务承担：","options":["A.有限责任","B.无限责任","C.无限连带责任","D.按份责任"],"answer":"B","analysis":"投资人以其个人财产对企业债务承担无限责任。","isKey":true},
  {"id":"commercial-006","chapter":5,"stem":"破产财产的分配顺序，优先于普通破产债权的是：","options":["A.破产费用","B.职工工资","C.税款","D.A和B和C"],"answer":"D","analysis":"破产费用、职工工资、税款都优先于普通破产债权。","isKey":true},
  {"id":"commercial-007","chapter":6,"stem":"下列关于票据的说法，正确的是：","options":["A.票据是有因证券","B.票据是无因证券","C.票据是要式证券","D.B和C"],"answer":"D","analysis":"票据是无因证券和要式证券。","isKey":true},
  {"id":"commercial-008","chapter":7,"stem":"保险合同的特征不包括：","options":["A.射幸合同","B.最大诚信合同","C.要式合同","D.附和合同"],"answer":"C","analysis":"保险合同不是要式合同。","isKey":true},
  {"id":"commercial-009","chapter":1,"stem":"有限责任公司的股东人数上限为：","options":["A.20人","B.50人","C.100人","D.200人"],"answer":"B","analysis":"有限责任公司股东人数为50人以下。","isKey":true},
  {"id":"commercial-010","chapter":1,"stem":"股份有限公司的股东人数下限为：","options":["A.1人","B.2人","C.5人","D.10人"],"answer":"B","analysis":"股份有限公司应当有2人以上200人以下为发起人。","isKey":true},
  {"id":"commercial-011","chapter":2,"stem":"有限合伙企业的合伙人人数上限为：","options":["A.20人","B.50人","C.100人","D.200人"],"answer":"B","analysis":"有限合伙企业由2个以上50个以下合伙人设立。","isKey":true},
  {"id":"commercial-012","chapter":5,"stem":"破产申请的条件不包括：","options":["A.不能清偿到期债务","B.资产不足以清偿全部债务","C.明显缺乏清偿能力","D.经营亏损"],"answer":"D","analysis":"经营亏损不是破产申请的条件。","isKey":true},
  {"id":"commercial-013","chapter":6,"stem":"下列不属于票据行为的是：","options":["A.出票","B.背书","C.承兑","D.付款"],"answer":"D","analysis":"付款不是票据行为。","isKey":true},
  {"id":"commercial-014","chapter":7,"stem":"保险合同的当事人不包括：","options":["A.保险人","B.投保人","C.被保险人","D.受益人"],"answer":"D","analysis":"受益人不是保险合同的当事人。","isKey":true},
  {"id":"commercial-015","chapter":8,"stem":"证券发行的条件不包括：","options":["A.具备健全且运行良好的组织机构","B.具有持续经营能力","C.最近三年财务会计报告被出具无保留意见审计报告","D.必须是上市公司"],"answer":"D","analysis":"证券发行不要求必须是上市公司。","isKey":true},
  {"id":"commercial-016","chapter":1,"stem":"公司监事会的职权不包括：","options":["A.检查公司财务","B.对董事进行监督","C.执行股东会决议","D.对董事提起诉讼"],"answer":"C","analysis":"执行股东会决议是董事会的职权。","isKey":true},
  {"id":"commercial-017","chapter":2,"stem":"普通合伙企业的合伙人至少为：","options":["A.1人","B.2人","C.3人","D.5人"],"answer":"B","analysis":"普通合伙企业由普通合伙人组成，至少2人。","isKey":true},
  {"id":"commercial-018","chapter":5,"stem":"管理人由谁指定？","options":["A.债权人会议","B.人民法院","C.债务人","D.人民政府"],"answer":"B","analysis":"管理人由人民法院指定。","isKey":true},
  {"id":"commercial-019","chapter":6,"stem":"下列关于汇票的说法，正确的是：","options":["A.汇票只能见票即付","B.汇票可以见票即付或定日付款","C.汇票只能定日付款","D.汇票不能转让"],"answer":"B","analysis":"汇票可以见票即付或定日付款。","isKey":true},
  {"id":"commercial-020","chapter":7,"stem":"代位求偿权适用于：","options":["A.人身保险","B.财产保险","C.所有保险","D.人寿保险"],"answer":"B","analysis":"代位求偿权适用于财产保险。","isKey":true},
  {"id":"commercial-021","chapter":1,"stem":"公司董事会的职权不包括：","options":["A.召集股东会会议","B.决定公司的经营计划","C.修改公司章程","D.决定公司内部管理机构的设置"],"answer":"C","analysis":"修改公司章程是股东会的职权。","isKey":true},
  {"id":"commercial-022","chapter":2,"stem":"有限合伙人可以：","options":["A.执行合伙事务","B.对外代表合伙企业","C.参与决定普通合伙人入伙","D.对企业的经营管理提出建议"],"answer":"D","analysis":"有限合伙人可以对企业的经营管理提出建议。","isKey":true},
  {"id":"commercial-023","chapter":5,"stem":"债权人会议的职权不包括：","options":["A.核查债权","B.监督管理人","C.决定破产申请","D.通过破产财产分配方案"],"answer":"C","analysis":"决定破产申请不是债权人会议的职权。","isKey":true},
  {"id":"commercial-024","chapter":6,"stem":"支票的付款期限为：","options":["A.见票即付","B.定日付款","C.见票后定期付款","D.出票后定期付款"],"answer":"A","analysis":"支票见票即付。","isKey":true},
  {"id":"commercial-025","chapter":7,"stem":"保险人的义务不包括：","options":["A.赔偿保险金","B.说明义务","C.及时理赔","D.代位求偿"],"answer":"D","analysis":"代位求偿是保险人的权利，不是义务。","isKey":true},
  {"id":"commercial-026","chapter":1,"stem":"股份有限公司的设立方式包括：","options":["A.只能发起设立","B.只能募集设立","C.发起设立或募集设立","D.以上都不对"],"answer":"C","analysis":"股份有限公司可以采取发起设立或者募集设立的方式。","isKey":true},
  {"id":"commercial-027","chapter":2,"stem":"合伙企业的利润分配，应当：","options":["A.按出资比例分配","B.按人头平均分配","C.按合伙协议约定分配","D.由合伙人协商确定"],"answer":"C","analysis":"合伙企业的利润分配按照合伙协议的约定办理。","isKey":true},
  {"id":"commercial-028","chapter":5,"stem":"破产费用包括：","options":["A.破产案件的诉讼费用","B.管理、变价和分配债务人财产的费用","C.管理人执行职务的费用","D.以上都是"],"answer":"D","analysis":"破产费用包括以上各项。","isKey":true},
  {"id":"commercial-029","chapter":6,"stem":"票据的特征不包括：","options":["A.设权证券","B.要式证券","C.有因证券","D.文义证券"],"answer":"C","analysis":"票据是无因证券，不是有因证券。","isKey":true},
  {"id":"commercial-030","chapter":7,"stem":"投保人的义务不包括：","options":["A.支付保险费","B.如实告知","C.及时通知","D.赔偿保险金"],"answer":"D","analysis":"赔偿保险金是保险人的义务。","isKey":true}
]
