[
  {
    "id": "level2-001",
    "chapter": 1,
    "stem": "根据《个人信息保护法》，处理敏感个人信息应当取得个人的（ ），法律、行政法规另有规定的除外。",
    "options": [
      "A. 书面同意",
      "B. 单独同意",
      "C. 口头同意",
      "D. 默认同意"
    ],
    "answer": "B",
    "analysis": "《个人信息保护法》明确规定，处理敏感个人信息应当取得个人的单独同意。这是敏感个人信息处理的强制性要求，旨在加强对敏感个人信息的保护。",
    "isKey": true
  },
  {
    "id": "level2-002",
    "chapter": 1,
    "stem": "根据数据安全法，国家建立数据（ ）保护制度，根据数据在经济社会发展中的重要程度，以及一旦遭到篡改、破坏、泄露或者非法获取、非法利用所造成的危害程度，对数据实行分类分级保护。",
    "options": [
      "A. 分类分级",
      "B. 分区域",
      "C. 分行业",
      "D. 分级别"
    ],
    "answer": "A",
    "analysis": "《数据安全法》建立了数据分类分级保护制度，这是数据安全管理的核心制度。根据数据的重要程度和可能造成的危害程度，将数据分为不同类别和级别，实施差异化的保护措施。",
    "isKey": true
  },
  {
    "id": "level2-003",
    "chapter": 1,
    "stem": "以下哪种行为属于《互联网信息服务算法推荐管理规定》中禁止的行为？",
    "options": [
      "A. 根据用户偏好推荐内容",
      "B. 利用算法对消费者在交易价格等交易条件上实行不合理的差别待遇",
      "C. 向用户展示个性化广告",
      "D. 使用算法优化搜索结果"
    ],
    "answer": "B",
    "analysis": "《算法推荐管理规定》明确禁止利用算法对消费者在交易价格等交易条件上实行不合理的差别待遇（即“大数据杀熟”）。其他选项在合规前提下都是允许的。",
    "isKey": true
  },
  {
    "id": "level2-004",
    "chapter": 1,
    "stem": "以下哪种数据脱敏方法是用星号或特定字符替换部分信息，适用于身份证、手机号等字段？",
    "options": [
      "A. 掩码（Masking）",
      "B. 替换（Substitution）",
      "C. 泛化（Generalization）",
      "D. 加噪（Noise Addition）"
    ],
    "answer": "A",
    "analysis": "掩码（Masking）是用星号或特定字符替换部分信息的方法，常用于身份证、手机号等需要保留格式但隐藏部分内容的场景。替换是用虚构但格式一致的内容替换，泛化是将精确值转换为区间，加噪是添加随机噪声。",
    "isKey": false
  },
  {
    "id": "level2-005",
    "chapter": 1,
    "stem": "《生成式人工智能服务管理暂行办法》规定，生成式AI服务提供者对生成内容承担（ ）。",
    "options": [
      "A. 部分责任",
      "B. 主要责任",
      "C. 主体责任",
      "D. 次要责任"
    ],
    "answer": "C",
    "analysis": "《生成式AI管理暂行办法》明确规定，生成式AI服务提供者对生成内容承担主体责任。这意味着服务提供者需要对生成内容的安全性、合法性负责，建立内容审核和过滤机制。",
    "isKey": true
  },
  {
    "id": "level2-006",
    "chapter": 2,
    "stem": "数据分析的四个层次中，“将发生什么”属于（ ）。",
    "options": [
      "A. 描述性分析",
      "B. 诊断性分析",
      "C. 预测性分析",
      "D. 规范性分析"
    ],
    "answer": "C",
    "analysis": "预测性分析回答“将发生什么”的问题，通常使用机器学习、时间序列预测等方法。描述性分析回答“发生了什么”，诊断性分析回答“为什么发生”，规范性分析回答“应该怎么做”。",
    "isKey": true
  },
  {
    "id": "level2-007",
    "chapter": 2,
    "stem": "在特征工程中，将类别型特征转换为二进制向量的方法称为（ ）。",
    "options": [
      "A. Label编码",
      "B. One-Hot编码",
      "C. 目标编码",
      "D. 标准化"
    ],
    "answer": "B",
    "analysis": "One-Hot编码（独热编码）是将类别型特征转换为二进制向量的方法，每个类别对应一个二进制位。适用于类别数量较少的情况。Label编码是将类别映射为整数，适用于有序类别。",
    "isKey": true
  },
  {
    "id": "level2-008",
    "chapter": 2,
    "stem": "指标体系设计中的SMART原则，其中“R”代表（ ）。",
    "options": [
      "A. 可靠性（Reliability）",
      "B. 相关性（Relevant）",
      "C. 可重复性（Repeatability）",
      "D. 实时性（Real-time）"
    ],
    "answer": "B",
    "analysis": "SMART原则中，R代表Relevant（相关性），指标应与业务目标紧密相关。SMART全称为：Specific（具体）、Measurable（可衡量）、Achievable（可实现）、Relevant（相关性）、Time-bound（时效性）。",
    "isKey": true
  },
  {
    "id": "level2-009",
    "chapter": 2,
    "stem": "以下哪种分析方法适用于发现不同变量之间的关系，如购物篮分析？",
    "options": [
      "A. 漏斗分析",
      "B. 关联分析",
      "C. 留存分析",
      "D. cohort分析"
    ],
    "answer": "B",
    "analysis": "关联分析用于发现变量之间的关系，典型应用是购物篮分析（如“购买A商品的用户也购买B商品”）。漏斗分析关注转化路径，留存分析关注用户留存，cohort分析关注用户分群的长期行为。",
    "isKey": false
  },
  {
    "id": "level2-010",
    "chapter": 2,
    "stem": "OSM模型中的“O”代表（ ）。",
    "options": [
      "A. 操作（Operation）",
      "B. 目标（Objective）",
      "C. 组织（Organization）",
      "D. 输出（Output）"
    ],
    "answer": "B",
    "analysis": "OSM模型是一种指标体系设计方法，O代表Objective（目标），S代表Strategy（策略），M代表Measurement（衡量）。通过明确业务目标，推导实现策略，最后确定衡量指标。",
    "isKey": true
  },
  {
    "id": "level2-011",
    "chapter": 2,
    "stem": "在电商数据分析中，用于衡量用户从访问到购买各环节转化效率的分析方法是（ ）。",
    "options": [
      "A. 漏斗分析",
      "B. 留存分析",
      "C. 关联分析",
      "D. cohort分析"
    ],
    "answer": "A",
    "analysis": "漏斗分析用于分析用户从访问到购买的转化路径，计算各环节的转化率和流失率，帮助发现转化瓶颈。留存分析关注用户是否持续使用，关联分析发现变量关系，cohort分析研究用户分群长期行为。",
    "isKey": false
  },
  {
    "id": "level2-012",
    "chapter": 3,
    "stem": "在二分类问题中，实际为正例且被正确预测为正例的样本称为（ ）。",
    "options": [
      "A. FP（假阳性）",
      "B. FN（假阴性）",
      "C. TP（真阳性）",
      "D. TN（真阴性）"
    ],
    "answer": "C",
    "analysis": "TP（True Positive，真阳性）表示实际为正例且被正确预测为正例的样本数量。FP是实际为负例但被错误预测为正例，FN是实际为正例但被错误预测为负例，TN是实际为负例且被正确预测为负例。",
    "isKey": true
  },
  {
    "id": "level2-013",
    "chapter": 3,
    "stem": "以下哪种情况最容易导致模型过拟合？",
    "options": [
      "A. 训练数据量很大，模型复杂度低",
      "B. 训练数据量很小，模型复杂度高",
      "C. 训练数据量很大，模型复杂度高",
      "D. 训练数据量很小，模型复杂度低"
    ],
    "answer": "B",
    "analysis": "过拟合通常发生在训练数据量小而模型复杂度高的情况下。模型过于复杂时会“记住”训练数据中的噪声，导致在测试集上表现差。解决方案包括增加数据量、降低模型复杂度、正则化、早停等。",
    "isKey": true
  },
  {
    "id": "level2-014",
    "chapter": 3,
    "stem": "以下哪种超参数优化方法通过建立代理模型来选择下一个评估点，适合计算成本高的场景？",
    "options": [
      "A. 网格搜索",
      "B. 随机搜索",
      "C. 贝叶斯优化",
      "D. 穷举搜索"
    ],
    "answer": "C",
    "analysis": "贝叶斯优化通过建立代理模型（如高斯过程）来建模超参数与模型性能之间的关系，然后根据采集函数选择下一个最有潜力的评估点。相比网格搜索和随机搜索，贝叶斯优化在样本效率上更有优势，适合计算成本高的场景。",
    "isKey": true
  },
  {
    "id": "level2-015",
    "chapter": 3,
    "stem": "ROC曲线下面积（AUC）的取值范围是（ ），越接近1表示模型区分能力越强。",
    "options": [
      "A. [0, 1]",
      "B. [-1, 1]",
      "C. [0, 100]",
      "D. [-∞, +∞]"
    ],
    "answer": "A",
    "analysis": "AUC（Area Under Curve）的取值范围是[0, 1]。AUC=1表示完美分类器，AUC=0.5相当于随机猜测，AUC<0.5表示模型比随机猜测还差。AUC越接近1，模型的区分能力越强。",
    "isKey": true
  },
  {
    "id": "level2-016",
    "chapter": 3,
    "stem": "以下哪种模型评估指标对类别不平衡数据集更具参考价值？",
    "options": [
      "A. 准确率（Accuracy）",
      "B. 精确率（Precision）",
      "C. 召回率（Recall）",
      "D. F1分数"
    ],
    "answer": "D",
    "analysis": "在不平衡数据集中，准确率会产生误导（如95%负例的数据集，全部预测为负例即可获得95%准确率）。F1分数是精确率和召回率的调和平均，能够更全面地评估模型在不平衡数据集上的表现。",
    "isKey": true
  },
  {
    "id": "level2-017",
    "chapter": 3,
    "stem": "在模型部署中，适用于实时推荐、实时风控等需要低延迟响应的场景的部署模式是（ ）。",
    "options": [
      "A. 批量部署",
      "B. 在线部署",
      "C. 边缘部署",
      "D. 离线部署"
    ],
    "answer": "B",
    "analysis": "在线部署（Online Deployment）模式能够实时响应用户请求，提供低延迟的预测服务，适用于实时推荐、实时风控等场景。批量部署用于定时批量处理，边缘部署用于终端设备，离线部署用于非实时场景。",
    "isKey": false
  },
  {
    "id": "level2-018",
    "chapter": 3,
    "stem": "以下哪种情况属于数据漂移（Data Drift）？",
    "options": [
      "A. 模型的预测准确率逐渐下降",
      "B. 输入数据的分布发生了变化",
      "C. 模型的训练时间变长",
      "D. 模型参数不再更新"
    ],
    "answer": "B",
    "analysis": "数据漂移（Data Drift）指的是输入数据的分布发生了变化，可能导致模型性能下降。概念漂移（Concept Drift）指的是目标变量的分布发生了变化。模型准确率下降可能是数据漂移或概念漂移的结果，但不是漂移的定义本身。",
    "isKey": true
  },
  {
    "id": "level2-019",
    "chapter": 3,
    "stem": "以下哪种方法不是常用的超参数优化方法？",
    "options": [
      "A. 网格搜索",
      "B. 随机搜索",
      "C. 梯度下降",
      "D. 贝叶斯优化"
    ],
    "answer": "C",
    "analysis": "梯度下降是模型参数的优化方法，用于最小化损失函数，不是超参数的优化方法。网格搜索、随机搜索、贝叶斯优化是三种主要的超参数优化方法。超参数是在训练前设置的参数（如学习率、批大小），不是通过训练学习的参数。",
    "isKey": true
  },
  {
    "id": "level2-020",
    "chapter": 3,
    "stem": "以下关于RMSE（均方根误差）的描述，正确的是（ ）。",
    "options": [
      "A. RMSE是MSE的倒数",
      "B. RMSE是MSE的平方根",
      "C. RMSE比MSE对异常值更敏感",
      "D. RMSE的取值范围是[0, 1]"
    ],
    "answer": "B",
    "analysis": "RMSE（Root Mean Squared Error）是MSE（Mean Squared Error）的平方根。计算MSE时对误差进行了平方，导致数值量级与原始数据不同，RMSE将其开方后恢复到与原始数据相同的量级，便于解释。MSE比RMSE对异常值更敏感（因为平方放大了大误差）。",
    "isKey": false
  },
  {
    "id": "level2-021",
    "chapter": 2,
    "stem": "以下哪种分析方法用于研究特定用户群体在后续时间内的行为表现，如2024年1月新用户的留存情况？",
    "options": [
      "A. 漏斗分析",
      "B. 留存分析",
      "C. cohort分析",
      "D. 关联分析"
    ],
    "answer": "C",
    "analysis": "cohort分析（群组分析）将用户按特定时间或行为分组，追踪每个群组在后续时间内的行为表现。例如，分析2024年1月注册用户在第1天、第7天、第30天的留存率。留存分析通常指整体的留存情况，cohort分析更关注不同群组的差异。",
    "isKey": false
  },
  {
    "id": "level2-022",
    "chapter": 1,
    "stem": "根据《个人信息保护法》，个人信息处理者处理个人信息应当采取（ ）措施，防止个人信息泄露、篡改、丢失。",
    "options": [
      "A. 一般保护",
      "B. 必要保护",
      "C. 严格保护",
      "D. 相应级别的安全保护"
    ],
    "answer": "D",
    "analysis": "《个人信息保护法》要求个人信息处理者根据个人信息的处理目的、处理方式、个人信息的种类以及对个人权益的影响、可能存在的安全风险等，采取相应的安全保护措施。不是单一级别的保护，而是根据风险评估采取相应级别的保护措施。",
    "isKey": false
  },
  {
    "id": "level2-023",
    "chapter": 3,
    "stem": "在模型迭代过程中，以下哪项不是触发模型重新训练的常见原因？",
    "options": [
      "A. 模型性能下降到阈值以下",
      "B. 数据分布发生显著变化",
      "C. 训练数据量增加了10%",
      "D. 业务场景发生变化"
    ],
    "answer": "C",
    "analysis": "触发模型重新训练的常见原因包括：模型性能下降、数据分布变化（数据漂移）、业务场景变化、新技术/新算法出现。训练数据量增加10%通常不足以成为触发重新训练的理由，除非性能有明显下降。",
    "isKey": false
  },
  {
    "id": "level2-024",
    "chapter": 2,
    "stem": "AARRR模型中的第二个A代表（ ）。",
    "options": [
      "A. Acquisition（获取）",
      "B. Activation（激活）",
      "C. Retention（留存）",
      "D. Revenue（营收）"
    ],
    "answer": "B",
    "analysis": "AARRR模型的五个阶段分别是：Acquisition（获取用户）、Activation（激活用户）、Retention（提高留存）、Revenue（增加营收）、Referral（传播推荐）。第二个A是Activation，指让用户完成首次关键行为，获得良好体验。",
    "isKey": false
  }
]
