[
  {"id":"ie-001","chapter":1,"stem":"CISG不适用于：","options":["A.营业地在不同缔约国的当事人之间的货物销售","B.购买供私人使用的货物的销售","C.国际私法规则导致适用缔约国法律的销售","D.以上都不是"],"answer":"B","analysis":"CISG排除适用购买供私人、家人或家庭使用的货物的销售。","isKey":true},
  {"id":"ie-002","chapter":1,"stem":"在CIF术语下，风险转移的时间是：","options":["A.货物交给承运人时","B.货物装上船时","C.货物到达目的港时","D.买方收到货物时"],"answer":"B","analysis":"在CIF术语下，风险在货物装上船时转移。","isKey":true},
  {"id":"ie-003","chapter":1,"stem":"FOB术语下，负责运输的是：","options":["A.卖方","B.买方","C.承运人","D.保险公司"],"answer":"B","analysis":"在FOB术语下，买方负责运输。","isKey":true},
  {"id":"ie-004","chapter":1,"stem":"CISG规定的根本违约是指：","options":["A.任何违约","B.使对方蒙受损害的违约","C.实际上剥夺了对方根据合同有权期待得到的东西的违约","D.故意违约"],"answer":"C","analysis":"根本违约是指违反合同的结果实际上剥夺了对方根据合同规定有权期待得到的东西。","isKey":true},
  {"id":"ie-005","chapter":1,"stem":"在CIF术语下，负责保险的是：","options":["A.卖方","B.买方","C.承运人","D.双方共同"],"answer":"A","analysis":"在CIF术语下，卖方负责保险。","isKey":true},
  {"id":"ie-006","chapter":2,"stem":"提单的法律性质包括：","options":["A.运输合同的证明","B.货物收据","C.物权凭证","D.以上都是"],"answer":"D","analysis":"提单具有运输合同的证明、货物收据、物权凭证三重法律性质。","isKey":true},
  {"id":"ie-007","chapter":2,"stem":"《海牙规则》规定的承运人责任期间是：","options":["A.港至港","B.钩至钩","C.门到门","D.仓至仓"],"answer":"B","analysis":"《海牙规则》规定的承运人责任期间是钩至钩。","isKey":true},
  {"id":"ie-008","chapter":2,"stem":"一切险承保的风险包括：","options":["A.平安险承保的风险","B.水渍险承保的风险","C.一般附加险承保的风险","D.以上都是"],"answer":"D","analysis":"一切险包括水渍险和一般附加险。","isKey":true},
  {"id":"ie-009","chapter":3,"stem":"信用证的基本原则是：","options":["A.独立性原则","B.单证相符原则","C.以上都是","D.以上都不是"],"answer":"C","analysis":"信用证的基本原则包括独立性原则和单证相符原则。","isKey":true},
  {"id":"ie-010","chapter":3,"stem":"在信用证支付方式下，银行审查的是：","options":["A.货物","B.单据","C.合同","D.以上都是"],"answer":"B","analysis":"银行只审查单据是否与信用证相符。","isKey":true},
  {"id":"ie-011","chapter":4,"stem":"反倾销的条件包括：","options":["A.存在倾销","B.存在损害","C.因果关系","D.以上都是"],"answer":"D","analysis":"反倾销需要满足倾销、损害和因果关系三个条件。","isKey":true},
  {"id":"ie-012","chapter":4,"stem":"反倾销税的征收期限一般不超过：","options":["A.3年","B.5年","C.8年","D.10年"],"answer":"B","analysis":"反倾销税的征收期限一般不超过5年。","isKey":true},
  {"id":"ie-013","chapter":4,"stem":"WTO的基本原则包括：","options":["A.最惠国待遇原则","B.国民待遇原则","C.透明度原则","D.以上都是"],"answer":"D","analysis":"WTO的基本原则包括最惠国待遇原则、国民待遇原则和透明度原则。","isKey":true},
  {"id":"ie-014","chapter":5,"stem":"MIGA承保的险别包括：","options":["A.货币汇兑险","B.征收险","C.战争内乱险","D.以上都是"],"answer":"D","analysis":"MIGA承保的险别包括货币汇兑险、征收和类似措施险、违约险、战争和内乱险。","isKey":true},
  {"id":"ie-015","chapter":5,"stem":"ICSID仲裁的管辖权适用于：","options":["A.缔约国之间的争端","B.缔约国与另一缔约国国民之间的投资争端","C.私人之间的投资争端","D.所有投资争端"],"answer":"B","analysis":"ICSID仲裁的管辖权适用于缔约国与另一缔约国国民之间直接因投资而产生的法律争端。","isKey":true},
  {"id":"ie-016","chapter":6,"stem":"国际融资担保的方式包括：","options":["A.保证","B.备用信用证","C.抵押","D.以上都是"],"answer":"D","analysis":"国际融资担保的方式包括信用担保和物权担保。","isKey":true},
  {"id":"ie-017","chapter":7,"stem":"解决国际双重征税的方法包括：","options":["A.免税法","B.抵免法","C.扣除法","D.以上都是"],"answer":"D","analysis":"解决国际双重征税的方法包括免税法、抵免法和扣除法。","isKey":true},
  {"id":"ie-018","chapter":8,"stem":"国际商事仲裁协议应当采用：","options":["A.口头形式","B.书面形式","C.任何形式","D.由当事人选择"],"answer":"B","analysis":"仲裁协议应当采用书面形式。","isKey":true},
  {"id":"ie-019","chapter":1,"stem":"CISG适用的货物销售不包括：","options":["A.机器设备","B.原材料","C.船舶","D.消费品"],"answer":"C","analysis":"CISG排除适用船舶、船只、气垫船或飞机的销售。","isKey":true},
  {"id":"ie-020","chapter":1,"stem":"在FOB术语下，负责保险的是：","options":["A.卖方","B.买方","C.承运人","D.双方共同"],"answer":"B","analysis":"在FOB术语下，买方负责保险。","isKey":true},
  {"id":"ie-021","chapter":2,"stem":"《汉堡规则》规定的承运人责任期间是：","options":["A.钩至钩","B.港至港","C.门到门","D.仓至仓"],"answer":"B","analysis":"《汉堡规则》规定的承运人责任期间是港至港。","isKey":true},
  {"id":"ie-022","chapter":2,"stem":"平安险承保的风险不包括：","options":["A.自然灾害造成的全损","B.共同海损","C.自然灾害造成的部分损失","D.意外事故造成的全损"],"answer":"C","analysis":"平安险不承保自然灾害造成的部分损失。","isKey":true},
  {"id":"ie-023","chapter":3,"stem":"信用证欺诈例外的条件是：","options":["A.欺诈必须是实质性的","B.欺诈必须是受益人实施的","C.银行必须有充分的证据","D.以上都是"],"answer":"D","analysis":"信用证欺诈例外需要满足实质性欺诈、受益人实施、充分证据等条件。","isKey":true},
  {"id":"ie-024","chapter":4,"stem":"保障措施的期限一般不超过：","options":["A.3年","B.4年","C.5年","D.10年"],"answer":"B","analysis":"保障措施的期限一般不超过4年。","isKey":true},
  {"id":"ie-025","chapter":5,"stem":"外商投资法实行的管理制度是：","options":["A.审批制","B.备案制","C.准入前国民待遇加负面清单","D.核准制"],"answer":"C","analysis":"外商投资法实行准入前国民待遇加负面清单管理制度。","isKey":true},
  {"id":"ie-026","chapter":7,"stem":"税收管辖权的类型包括：","options":["A.居民税收管辖权","B.来源地税收管辖权","C.以上都是","D.以上都不是"],"answer":"C","analysis":"税收管辖权包括居民税收管辖权和来源地税收管辖权。","isKey":true},
  {"id":"ie-027","chapter":8,"stem":"《纽约公约》的全称是：","options":["A.《承认及执行外国仲裁裁决公约》","B.《解决国家与他国国民之间投资争端公约》","C.《国际商事仲裁公约》","D.《国际投资争端公约》"],"answer":"A","analysis":"《纽约公约》的全称是《承认及执行外国仲裁裁决公约》。","isKey":true},
  {"id":"ie-028","chapter":1,"stem":"CISG规定的卖方义务包括：","options":["A.交付货物","B.移交单据","C.转移所有权","D.以上都是"],"answer":"D","analysis":"卖方义务包括交付货物、移交单据、转移所有权。","isKey":true},
  {"id":"ie-029","chapter":1,"stem":"涉及运输的货物，风险转移的时间是：","options":["A.货交第一承运人时","B.货物装上船时","C.货物到达目的地时","D.买方收到货物时"],"answer":"A","analysis":"涉及运输的，风险在货交第一承运人时转移。","isKey":true},
  {"id":"ie-030","chapter":2,"stem":"《鹿特丹规则》规定的承运人责任期间是：","options":["A.钩至钩","B.港至港","C.门到门","D.仓至仓"],"answer":"C","analysis":"《鹿特丹规则》规定的承运人责任期间是门到门。","isKey":true},
  {"id":"ie-031","chapter":3,"stem":"托收的种类包括：","options":["A.光票托收","B.跟单托收","C.以上都是","D.以上都不是"],"answer":"C","analysis":"托收包括光票托收和跟单托收。","isKey":true},
  {"id":"ie-032","chapter":4,"stem":"反补贴的条件包括：","options":["A.存在专向性补贴","B.存在损害","C.因果关系","D.以上都是"],"answer":"D","analysis":"反补贴需要满足专向性补贴、损害和因果关系三个条件。","isKey":true},
  {"id":"ie-033","chapter":5,"stem":"ICSID仲裁的依据是：","options":["A.《纽约公约》","B.《华盛顿公约》","C.《海牙公约》","D.《巴黎公约》"],"answer":"B","analysis":"ICSID仲裁的依据是《华盛顿公约》。","isKey":true},
  {"id":"ie-034","chapter":6,"stem":"世界银行贷款的特点是：","options":["A.利率低","B.期限长","C.条件优惠","D.以上都是"],"answer":"D","analysis":"世界银行贷款具有利率低、期限长、条件优惠的特点。","isKey":true},
  {"id":"ie-035","chapter":7,"stem":"国际避税的方式包括：","options":["A.转移定价","B.资本弱化","C.利用避税地","D.以上都是"],"answer":"D","analysis":"国际避税的方式包括转移定价、资本弱化、利用避税地等。","isKey":true},
  {"id":"ie-036","chapter":8,"stem":"拒绝承认与执行外国仲裁裁决的理由不包括：","options":["A.仲裁协议无效","B.仲裁程序不当","C.裁决对当事人不利","D.违反公共秩序"],"answer":"C","analysis":"裁决对当事人不利不是拒绝承认与执行的理由。","isKey":true},
  {"id":"ie-037","chapter":1,"stem":"CIF术语的全称是：","options":["A.Cost, Insurance and Freight","B.Cost and Freight","C.Free On Board","D.Free Carrier"],"answer":"A","analysis":"CIF的全称是Cost, Insurance and Freight。","isKey":true},
  {"id":"ie-038","chapter":1,"stem":"CFR术语下，负责保险的是：","options":["A.卖方","B.买方","C.承运人","D.双方共同"],"answer":"B","analysis":"在CFR术语下，买方负责保险。","isKey":true},
  {"id":"ie-039","chapter":2,"stem":"清洁提单是指：","options":["A.提单上没有批注","B.提单上注明货物表面状况良好","C.以上都是","D.以上都不是"],"answer":"C","analysis":"清洁提单是指提单上没有不良批注或注明货物表面状况良好。","isKey":true},
  {"id":"ie-040","chapter":3,"stem":"《跟单信用证统一惯例》的最新版本是：","options":["A.UCP400","B.UCP500","C.UCP600","D.UCP700"],"answer":"C","analysis":"《跟单信用证统一惯例》的最新版本是UCP600。","isKey":true},
  {"id":"ie-041","chapter":4,"stem":"保障措施的总期限不超过：","options":["A.5年","B.8年","C.10年","D.15年"],"answer":"C","analysis":"保障措施的总期限不超过10年。","isKey":true},
  {"id":"ie-042","chapter":5,"stem":"MIGA的全称是：","options":["A.多边投资担保机构","B.解决投资争端国际中心","C.国际货币基金组织","D.世界银行"],"answer":"A","analysis":"MIGA的全称是多边投资担保机构。","isKey":true},
  {"id":"ie-043","chapter":7,"stem":"居民税收管辖权中，法人居民身份的认定标准包括：","options":["A.注册地标准","B.实际管理机构所在地标准","C.总机构所在地标准","D.以上都是"],"answer":"D","analysis":"法人居民身份的认定标准包括注册地标准、实际管理机构所在地标准、总机构所在地标准。","isKey":true},
  {"id":"ie-044","chapter":8,"stem":"ICSID仲裁裁决的效力是：","options":["A.对双方有约束力","B.可以上诉","C.不具有执行力","D.由当事人选择"],"answer":"A","analysis":"ICSID仲裁裁决对双方有约束力，不得上诉。","isKey":true},
  {"id":"ie-045","chapter":1,"stem":"CISG规定的风险转移原则，不涉及运输的，风险在：","options":["A.订立合同时转移","B.交货时转移","C.付款时转移","D.收货时转移"],"answer":"B","analysis":"不涉及运输的，在订立合同时已知道货物已在某一特定地点，从该地点交货时转移。","isKey":true},
  {"id":"ie-046","chapter":2,"stem":"海上货物运输保险的保险期间是：","options":["A.仓至仓","B.钩至钩","C.港至港","D.门到门"],"answer":"A","analysis":"海上货物运输保险的保险期间是仓至仓。","isKey":true},
  {"id":"ie-047","chapter":3,"stem":"信用证的当事人不包括：","options":["A.开证申请人","B.开证银行","C.通知银行","D.承运人"],"answer":"D","analysis":"信用证的当事人包括开证申请人、开证银行、通知银行、受益人，不包括承运人。","isKey":true},
  {"id":"ie-048","chapter":4,"stem":"反倾销税的纳税人是：","options":["A.出口经营者","B.进口经营者","C.生产商","D.消费者"],"answer":"B","analysis":"反倾销税的纳税人是进口经营者。","isKey":true},
  {"id":"ie-049","chapter":5,"stem":"外商投资法的负面清单规定的是：","options":["A.允许投资的领域","B.禁止投资的领域","C.限制投资的领域","D.以上都是"],"answer":"B","analysis":"负面清单规定禁止投资的领域。","isKey":true},
  {"id":"ie-050","chapter":7,"stem":"国际双重征税的类型包括：","options":["A.法律性双重征税","B.经济性双重征税","C.以上都是","D.以上都不是"],"answer":"C","analysis":"国际双重征税包括法律性双重征税和经济性双重征税。","isKey":true}
]
