[
  {"id":"crimproc-001","chapter":1,"stem":"下列哪项不属于刑事诉讼法的基本原则？","options":["A.侦查权由专门机关行使","B.未经判决不得定罪","C.罪刑法定原则","D.保障诉讼权利"],"answer":"C","analysis":"罪刑法定原则是刑法的基本原则。","isKey":true},
  {"id":"crimproc-002","chapter":2,"stem":"危害国家安全案件由哪个法院管辖？","options":["A.基层人民法院","B.中级人民法院","C.高级人民法院","D.最高人民法院"],"answer":"B","analysis":"危害国家安全案件由中级人民法院管辖。","isKey":true},
  {"id":"crimproc-003","chapter":2,"stem":"刑事案件一般由哪个法院管辖？","options":["A.被告人居住地法院","B.犯罪地法院","C.原告所在地法院","D.被告人户籍所在地法院"],"answer":"B","analysis":"刑事案件由犯罪地的人民法院管辖。","isKey":true},
  {"id":"crimproc-004","chapter":3,"stem":"下列人员中，不属于回避适用对象的是：","options":["A.审判人员","B.证人","C.书记员","D.鉴定人"],"answer":"B","analysis":"证人不适用回避制度。","isKey":true},
  {"id":"crimproc-005","chapter":4,"stem":"下列人员中，不得担任辩护人的是：","options":["A.律师","B.被告人的亲友","C.正在被执行刑罚的人","D.被告人所在单位推荐的人"],"answer":"C","analysis":"正在被执行刑罚的人不得担任辩护人。","isKey":true},
  {"id":"crimproc-006","chapter":4,"stem":"应当指定辩护的情形不包括：","options":["A.被告人是盲聋哑人","B.被告人是未成年人","C.可能被判处无期徒刑、死刑","D.被告人经济困难"],"answer":"D","analysis":"经济困难不是应当指定辩护的情形。","isKey":true},
  {"id":"crimproc-007","chapter":5,"stem":"取保候审的方式包括：","options":["A.只能提供保证人","B.只能交纳保证金","C.提供保证人或交纳保证金","D.不需要任何担保"],"answer":"C","analysis":"取保候审可以通过提供保证人或交纳保证金的方式。","isKey":true},
  {"id":"crimproc-008","chapter":5,"stem":"拘留的最长期限为：","options":["A.14日","B.30日","C.37日","D.60日"],"answer":"C","analysis":"流窜作案、多次作案、结伙作案的，拘留期限可以延长至37日。","isKey":true},
  {"id":"crimproc-009","chapter":5,"stem":"逮捕的批准权属于：","options":["A.公安机关","B.人民检察院","C.人民法院","D.人民政府"],"answer":"B","analysis":"逮捕犯罪嫌疑人、被告人，必须经过人民检察院批准或者人民法院决定。","isKey":true},
  {"id":"crimproc-010","chapter":6,"stem":"下列属于应当排除的非法证据是：","options":["A.通过合法搜查取得的物证","B.通过刑讯逼供取得的口供","C.通过合法询问取得的证人证言","D.通过合法鉴定取得的鉴定意见"],"answer":"B","analysis":"采用刑讯逼供等非法方法收集的犯罪嫌疑人、被告人供述，应当予以排除。","isKey":true},
  {"id":"crimproc-011","chapter":7,"stem":"立案的条件包括：","options":["A.有犯罪事实","B.需要追究刑事责任","C.已经查明犯罪嫌疑人","D.A和B"],"answer":"D","analysis":"立案的条件是有犯罪事实且需要追究刑事责任。","isKey":true},
  {"id":"crimproc-012","chapter":8,"stem":"侦查羁押期限一般为：","options":["A.1个月","B.2个月","C.3个月","D.6个月"],"answer":"B","analysis":"侦查羁押期限一般为2个月。","isKey":true},
  {"id":"crimproc-013","chapter":9,"stem":"下列关于不起诉的说法，正确的是：","options":["A.法定不起诉适用于犯罪情节轻微的情形","B.酌定不起诉适用于没有犯罪事实的情形","C.存疑不起诉适用于证据不足的情形","D.所有不起诉决定都需要经过上级批准"],"answer":"C","analysis":"存疑不起诉适用于二次补充侦查后证据不足的情形。","isKey":true},
  {"id":"crimproc-014","chapter":10,"stem":"下列关于上诉不加刑原则的说法，正确的是：","options":["A.二审法院在任何情况下都不得加重被告人刑罚","B.只有被告人上诉的，二审法院不得加重被告人刑罚","C.人民检察院抗诉的案件，也不得加重被告人刑罚","D.上诉不加刑原则只适用于自诉案件"],"answer":"B","analysis":"只有被告人上诉的，二审法院不得加重被告人刑罚。","isKey":true},
  {"id":"crimproc-015","chapter":10,"stem":"死刑由哪个机关核准？","options":["A.高级人民法院","B.最高人民法院","C.最高人民检察院","D.司法部"],"answer":"B","analysis":"死刑由最高人民法院核准。","isKey":true},
  {"id":"crimproc-016","chapter":10,"stem":"简易程序适用于：","options":["A.所有案件","B.案件事实清楚、证据充分，被告人认罪的案件","C.可能判处无期徒刑的案件","D.危害国家安全案件"],"answer":"B","analysis":"简易程序适用于案件事实清楚、证据充分，被告人认罪的案件。","isKey":true},
  {"id":"crimproc-017","chapter":11,"stem":"管制由哪个机关执行？","options":["A.公安机关","B.人民法院","C.社区矫正机构","D.监狱"],"answer":"C","analysis":"管制由社区矫正机构执行。","isKey":true},
  {"id":"crimproc-018","chapter":12,"stem":"未成年人案件诉讼程序的基本原则是：","options":["A.惩罚为主、教育为辅","B.教育为主、惩罚为辅","C.公开审理","D.可以公开审理"],"answer":"B","analysis":"未成年人案件诉讼程序遵循教育为主、惩罚为辅原则。","isKey":true},
  {"id":"crimproc-019","chapter":5,"stem":"取保候审的最长期限为：","options":["A.6个月","B.12个月","C.24个月","D.36个月"],"answer":"B","analysis":"取保候审的最长期限为12个月。","isKey":true},
  {"id":"crimproc-020","chapter":6,"stem":"刑事诉讼的证明标准是：","options":["A.优势证据","B.排除合理怀疑","C.高度盖然性","D.证据充分"],"answer":"B","analysis":"刑事诉讼的证明标准是排除合理怀疑。","isKey":true},
  {"id":"crimproc-021","chapter":8,"stem":"搜查必须出示：","options":["A.逮捕证","B.拘留证","C.搜查证","D.工作证"],"answer":"C","analysis":"搜查必须向被搜查人出示搜查证。","isKey":true},
  {"id":"crimproc-022","chapter":9,"stem":"审查起诉的期限一般为：","options":["A.15日","B.1个月","C.2个月","D.3个月"],"answer":"B","analysis":"人民检察院应当在1个月以内作出决定。","isKey":true},
  {"id":"crimproc-023","chapter":10,"stem":"二审法院应当就什么进行审查？","options":["A.只审查上诉部分","B.只审查抗诉部分","C.全面审查","D.只审查法律适用"],"answer":"C","analysis":"第二审人民法院应当就第一审判决认定的事实和适用法律进行全面审查。","isKey":true},
  {"id":"crimproc-024","chapter":4,"stem":"辩护律师自何时起可以查阅案卷材料？","options":["A.侦查阶段","B.审查起诉阶段","C.审判阶段","D.任何时候"],"answer":"B","analysis":"辩护律师自人民检察院对案件审查起诉之日起，可以查阅、摘抄、复制本案的案卷材料。","isKey":true},
  {"id":"crimproc-025","chapter":12,"stem":"当事人和解的公诉案件诉讼程序适用于：","options":["A.所有刑事案件","B.因民间纠纷引起的可能判处3年以下有期徒刑的案件","C.所有故意犯罪","D.所有过失犯罪"],"answer":"B","analysis":"因民间纠纷引起，涉嫌刑法分则第四章、第五章规定的犯罪案件，可能判处3年有期徒刑以下刑罚的。","isKey":true},
  {"id":"crimproc-026","chapter":2,"stem":"自诉案件不包括：","options":["A.告诉才处理的案件","B.被害人有证据证明的轻微刑事案件","C.危害国家安全案件","D.公诉转自诉案件"],"answer":"C","analysis":"危害国家安全案件属于公诉案件。","isKey":true},
  {"id":"crimproc-027","chapter":5,"stem":"监视居住的最长期限为：","options":["A.3个月","B.6个月","C.12个月","D.24个月"],"answer":"B","analysis":"监视居住的最长期限为6个月。","isKey":true},
  {"id":"crimproc-028","chapter":10,"stem":"速裁程序适用于可能判处多少年有期徒刑以下刑罚的案件？","options":["A.1年","B.3年","C.5年","D.7年"],"answer":"B","analysis":"速裁程序适用于可能判处3年有期徒刑以下刑罚的案件。","isKey":true},
  {"id":"crimproc-029","chapter":12,"stem":"缺席审判程序适用于：","options":["A.所有刑事案件","B.贪污贿赂犯罪案件","C.所有故意犯罪","D.所有过失犯罪"],"answer":"B","analysis":"缺席审判程序适用于贪污贿赂犯罪案件等。","isKey":true},
  {"id":"crimproc-030","chapter":6,"stem":"证据的种类不包括：","options":["A.物证","B.书证","C.推定","D.视听资料"],"answer":"C","analysis":"推定不属于证据的种类。","isKey":true}
]
