[
  {
    "id": "level1-001",
    "chapter": 1,
    "stem": "人工智能训练师在职业活动中，应当严格遵守的核心职业守则不包括以下哪项？",
    "options": [
      "A. 爱岗敬业，忠于职守",
      "B. 保守训练数据中的敏感信息",
      "C. 优先追求模型性能指标最大化",
      "D. 持续学习，跟进 AI 技术发展"
    ],
    "answer": "C",
    "analysis": "职业守则强调爱岗敬业、保守秘密、持续学习等，但并未要求'优先追求模型性能指标最大化'，而是强调在业务价值和伦理框架下优化模型。",
    "isKey": true
  },
  {
    "id": "level1-002",
    "chapter": 1,
    "stem": "关于 AI 伦理的六大原则，下列说法错误的是？",
    "options": [
      "A. 公平性要求避免数据偏见，确保算法不歧视特定群体",
      "B. 透明性要求完全公开 AI 模型的源代码",
      "C. 隐私保护要求最小化数据收集",
      "D. 责任明确要求在 AI 造成损害时明确责任归属"
    ],
    "answer": "B",
    "analysis": "透明性不等于完全公开源代码，而是指 AI 决策过程可解释、可审计。完全公开源代码既不现实也不必要。",
    "isKey": true
  },
  {
    "id": "level1-003",
    "chapter": 1,
    "stem": "《中华人民共和国数据安全法》中，以下哪类数据一旦泄露可能危害国家安全和公共利益？",
    "options": [
      "A. 公开数据",
      "B. 一般数据",
      "C. 重要数据",
      "D. 非敏感数据"
    ],
    "answer": "C",
    "analysis": "数据安全法建立了数据分类分级保护制度，其中'重要数据'指一旦泄露可能危害国家安全、公共利益的数据。",
    "isKey": true
  },
  {
    "id": "level1-004",
    "chapter": 1,
    "stem": "《个人信息保护法》中，处理个人信息应当遵循的核心原则是？",
    "options": [
      "A. 最大化收集原则",
      "B. 告知-同意原则和最小必要原则",
      "C. 无偿使用原则",
      "D. 永久保存原则"
    ],
    "answer": "B",
    "analysis": "个保法确立了告知-同意原则和最小必要原则，要求处理个人信息应取得个人明确同意，且收集范围限于实现目的的最小范围。",
    "isKey": true
  },
  {
    "id": "level1-005",
    "chapter": 1,
    "stem": "根据《互联网信息服务算法推荐管理规定》，以下哪项行为是被禁止的？",
    "options": [
      "A. 对算法推荐服务进行备案",
      "B. 向用户提供不针对个人特征的选项",
      "C. 利用算法诱导未成年人沉迷网络",
      "D. 定期评估算法推荐的公平性"
    ],
    "answer": "C",
    "analysis": "算法推荐管理规定明确禁止利用算法诱导未成年人沉迷网络。备案、提供非个性化选项、定期评估都是被鼓励或要求的行为。",
    "isKey": true
  },
  {
    "id": "level1-006",
    "chapter": 1,
    "stem": "根据《生成式人工智能服务管理暂行办法》，生成式 AI 训练数据应当满足以下哪项要求？",
    "options": [
      "A. 只要数据量大即可",
      "B. 应当具有合法性、真实性和多样性",
      "C. 优先使用版权保护期的数据",
      "D. 可以使用任何公开获取的数据"
    ],
    "answer": "B",
    "analysis": "生成式 AI 暂行办法明确要求训练数据应当具有合法性、真实性和多样性，不得使用侵权或非法获取的数据。",
    "isKey": false
  },
  {
    "id": "level1-007",
    "chapter": 1,
    "stem": "根据网络安全等级保护制度（等保 2.0），AI 训练数据处理平台通常应达到的最低保护等级是？",
    "options": [
      "A. 一级",
      "B. 二级或三级",
      "C. 四级",
      "D. 五级"
    ],
    "answer": "B",
    "analysis": "AI 训练数据处理平台通常涉及用户敏感信息，根据数据重要程度，应至少达到二级或三级保护要求。",
    "isKey": true
  },
  {
    "id": "level1-008",
    "chapter": 2,
    "stem": "在制定 AI 产品战略时，使用 SWOT 分析框架，以下哪项不属于'机会（Opportunities）'的范畴？",
    "options": [
      "A. 政策支持力度加大",
      "B. 市场需求快速增长",
      "C. 团队算法能力不足",
      "D. 技术进步带来新可能"
    ],
    "answer": "C",
    "analysis": "团队算法能力不足属于'劣势（Weaknesses）'，不是机会。政策支持、市场需求、技术进步都是外部机会。",
    "isKey": false
  },
  {
    "id": "level1-009",
    "chapter": 2,
    "stem": "AI 产品成熟度模型中，处于哪个阶段的组织能够量化度量 AI 价值并持续优化？",
    "options": [
      "A. 初始级",
      "B. 发展级",
      "C. 定义级",
      "D. 量化级"
    ],
    "answer": "D",
    "analysis": "量化级的特点是 AI 价值可量化度量，并持续进行优化。这是成熟度模型中的第四阶段。",
    "isKey": true
  },
  {
    "id": "level1-010",
    "chapter": 2,
    "stem": "以下哪项不是 AI 产品的典型商业模式？",
    "options": [
      "A. 按调用量收费的 API 服务",
      "B. 按用户订阅的 SaaS 模式",
      "C. 基于广告展示的免费模式",
      "D. 基于数据洞察的增值服务"
    ],
    "answer": "C",
    "analysis": "API 服务、SaaS 订阅、数据增值都是典型的 AI 商业模式。基于广告展示的免费模式不是 AI 产品特有的典型商业模式。",
    "isKey": false
  },
  {
    "id": "level1-011",
    "chapter": 2,
    "stem": "在 AI 产品指标体系中，'DAU（日活跃用户数）'属于哪个层级？",
    "options": [
      "A. 模型指标层",
      "B. 产品指标层",
      "C. 业务指标层",
      "D. 技术指标层"
    ],
    "answer": "C",
    "analysis": "DAU 是业务层面的用户活跃指标，属于业务指标层。三层指标体系为：业务指标→产品指标→模型指标。",
    "isKey": true
  },
  {
    "id": "level1-012",
    "chapter": 2,
    "stem": "在分类任务中，混淆矩阵的 TP（真正例）指的是？",
    "options": [
      "A. 实际为正例，预测为正例",
      "B. 实际为负例，预测为正例",
      "C. 实际为正例，预测为负例",
      "D. 实际为负例，预测为负例"
    ],
    "answer": "A",
    "analysis": "TP（True Positive）指实际为正例且被模型正确预测为正例的样本数。",
    "isKey": true
  },
  {
    "id": "level1-013",
    "chapter": 2,
    "stem": "在样本极度不平衡的场景下（正例占比 1%），以下哪个指标最有可能被高估？",
    "options": [
      "A. 精确率（Precision）",
      "B. 召回率（Recall）",
      "C. F1 分数",
      "D. 准确率（Accuracy）"
    ],
    "answer": "D",
    "analysis": "当正例占比极低时，模型只要全部预测为负例就能获得 99% 的准确率，但这毫无意义。此时应关注精确率、召回率和 F1 分数。",
    "isKey": true
  },
  {
    "id": "level1-014",
    "chapter": 2,
    "stem": "精确率（Precision）的计算公式是？",
    "options": [
      "A. TP/(TP+FN)",
      "B. TP/(TP+FP)",
      "C. (TP+TN)/(TP+TN+FP+FN)",
      "D. 2·P·R/(P+R)"
    ],
    "answer": "B",
    "analysis": "精确率 = TP/(TP+FP)，表示预测为正例的样本中实际为正例的比例，也称为查准率。",
    "isKey": true
  },
  {
    "id": "level1-015",
    "chapter": 2,
    "stem": "当精确率和召回率需要兼顾时，以下哪个指标最为合适？",
    "options": [
      "A. 准确率（Accuracy）",
      "B. F1 分数",
      "C. AUC",
      "D. 均方误差（MSE）"
    ],
    "answer": "B",
    "analysis": "F1 分数是精确率和召回率的调和平均，能够在两者之间取得平衡，特别适用于精确率和召回率需要兼顾的场景。",
    "isKey": true
  },
  {
    "id": "level1-016",
    "chapter": 2,
    "stem": "关于大语言模型（LLM）的业务应用，以下说法错误的是？",
    "options": [
      "A. 提示工程适用于快速验证场景",
      "B. RAG 可以降低模型幻觉问题",
      "C. 微调需要大量标注数据，成本较高",
      "D. 提示工程比微调效果更好，应优先选择"
    ],
    "answer": "D",
    "analysis": "提示工程、RAG 和微调各有适用场景，不能简单说哪个更好。提示工程适合快速验证，微调适合领域深度定制，RAG 适合知识密集型任务。应根据场景选择。",
    "isKey": true
  },
  {
    "id": "level1-017",
    "chapter": 2,
    "stem": "计算机视觉中，以下哪项技术主要用于定位图像中物体的位置和类别？",
    "options": [
      "A. 图像分类",
      "B. 目标检测",
      "C. 图像分割",
      "D. OCR"
    ],
    "answer": "B",
    "analysis": "目标检测（Object Detection）的任务是定位图像中物体的位置（边界框）并识别其类别。图像分类只输出类别，图像分割输出像素级掩码，OCR 专注于文字识别。",
    "isKey": false
  },
  {
    "id": "level1-018",
    "chapter": 2,
    "stem": "多模态 AI 应用中，以下哪项不属于多模态的应用场景？",
    "options": [
      "A. 图文理解（输入图片+文本，输出文本描述）",
      "B. 视觉问答（输入图片+问题，输出答案）",
      "C. 纯文本情感分析",
      "D. 视频分析（输入视频，输出行为识别）"
    ],
    "answer": "C",
    "analysis": "多模态 AI 需要处理多种模态的输入（如文本+图像+音频）。纯文本情感分析是单模态 NLP 任务，不属于多模态。",
    "isKey": false
  },
  {
    "id": "level1-019",
    "chapter": 2,
    "stem": "AI 功能上线前进行 A/B 测试时，实验组使用新 AI 方案，对照组应使用？",
    "options": [
      "A. 随机生成的假数据",
      "B. 现有的基线方案",
      "C. 另一个新 AI 方案",
      "D. 不做任何处理"
    ],
    "answer": "B",
    "analysis": "A/B 测试的对照组应使用现有的基线方案（如规则引擎、旧模型），实验组使用新方案，这样才能公平比较新方案是否优于旧方案。",
    "isKey": true
  },
  {
    "id": "level1-020",
    "chapter": 2,
    "stem": "灰度发布策略中，'小流量阶段'的流量比例通常是？",
    "options": [
      "A. 1%-5%",
      "B. 10%-20%",
      "C. 50%",
      "D. 100%"
    ],
    "answer": "A",
    "analysis": "灰度发布通常分四步：小流量（1%-5%）验证稳定性 → 中流量（10%-20%）观察业务指标 → 大流量（50%）全面验证 → 全量（100%）正式上线。",
    "isKey": true
  },
  {
    "id": "level1-021",
    "chapter": 3,
    "stem": "AI 项目生命周期中，通常占项目总时间最多的阶段是？",
    "options": [
      "A. 模型开发",
      "B. 系统集成",
      "C. 数据准备",
      "D. 部署上线"
    ],
    "answer": "C",
    "analysis": "数据准备（采集、清洗、标注、质检）通常占 AI 项目总时间的 60%-80%，是 AI 项目成功的关键和最大时间消耗环节。",
    "isKey": true
  },
  {
    "id": "level1-022",
    "chapter": 3,
    "stem": "对于需求不确定、需要快速迭代的 AI 项目，推荐使用哪种项目管理方法？",
    "options": [
      "A. 纯瀑布模型",
      "B. 敏捷方法（Scrum）",
      "C. 仅使用甘特图",
      "D. 只做文档不做迭代"
    ],
    "answer": "B",
    "analysis": "AI 项目具有探索性和不确定性，更适合敏捷方法。通过短迭代持续验证假设、收集反馈、优化模型，能有效降低风险。",
    "isKey": true
  },
  {
    "id": "level1-023",
    "chapter": 3,
    "stem": "在 AI 项目风险管理中，'数据质量差、标注不一致'属于哪种风险类型？",
    "options": [
      "A. 数据风险",
      "B. 技术风险",
      "C. 进度风险",
      "D. 合规风险"
    ],
    "answer": "A",
    "analysis": "数据质量差、标注不一致属于数据风险，是 AI 项目最核心的风险之一。应对策略包括数据质量审计、标准化标注流程等。",
    "isKey": true
  },
  {
    "id": "level1-024",
    "chapter": 3,
    "stem": "在典型的 AI 产品团队中，以下哪项不是人工智能训练师（高级技师）需要重点协调的角色？",
    "options": [
      "A. AI 算法工程师",
      "B. 数据标注员",
      "C. 前端工程师",
      "D. 运维工程师"
    ],
    "answer": "D",
    "analysis": "虽然运维工程师在团队中很重要，但人工智能训练师（高级技师）的核心协调对象是算法工程师、数据标注员、数据工程师和产品经理。运维更多涉及部署后的维护工作。",
    "isKey": false
  },
  {
    "id": "level1-025",
    "chapter": 3,
    "stem": "以下哪项措施不属于跨职能协作的优化方案？",
    "options": [
      "A. 建立业务术语表和指标词典",
      "B. 模型服务使用统一 API 格式",
      "C. 定期举行算法、产品、数据联合评审",
      "D. 让每个角色独立工作，减少沟通"
    ],
    "answer": "D",
    "analysis": "跨职能协作优化的核心是增加有效沟通，而不是减少沟通。统一语言、标准接口、联合评审都是积极的协作优化措施。",
    "isKey": true
  },
  {
    "id": "level1-026",
    "chapter": 3,
    "stem": "关于模型卡（Model Card）的作用，以下说法正确的是？",
    "options": [
      "A. 只包含模型的训练代码",
      "B. 记录模型用途、性能、局限性和伦理考量",
      "C. 用于替代模型的测试报告",
      "D. 仅用于算法工程师内部使用"
    ],
    "answer": "B",
    "analysis": "模型卡（Model Card）是记录模型关键信息的文档，包括模型用途、预期使用场景、性能指标、局限性、伦理考量等，是模型交付的重要组成部分。",
    "isKey": true
  },
  {
    "id": "level1-027",
    "chapter": 3,
    "stem": "AI 模型交付时，以下哪项不是必须的交付物？",
    "options": [
      "A. 训练好的模型文件",
      "B. 模型 API 接口",
      "C. 完整的业务运营方案",
      "D. 模型卡（Model Card）"
    ],
    "answer": "C",
    "analysis": "模型交付物包括模型文件、API、模型报告、模型卡、训练脚本和依赖说明。完整的业务运营方案属于产品层面，不是模型交付的必备内容。",
    "isKey": false
  },
  {
    "id": "level1-028",
    "chapter": 3,
    "stem": "AI 模型验收标准中，以下哪项不属于验收维度？",
    "options": [
      "A. 功能正确性",
      "B. 模型训练人员的学历背景",
      "C. 鲁棒性",
      "D. 合规性"
    ],
    "answer": "B",
    "analysis": "模型验收标准包括功能正确性、性能指标、稳定性、鲁棒性、合规性、文档完整性和可维护性。训练人员的学历背景不属于模型验收维度。",
    "isKey": true
  },
  {
    "id": "level1-029",
    "chapter": 3,
    "stem": "AI 模型交付后的知识转移步骤中，最后一步是？",
    "options": [
      "A. 技术培训",
      "B. 文档移交",
      "C. 交接会议",
      "D. 设置过渡支持期"
    ],
    "answer": "D",
    "analysis": "知识转移的标准步骤是：制定培训计划→技术培训→文档移交→交接会议→设置过渡支持期（通常 1-3 个月）。过渡支持期是最后一步。",
    "isKey": false
  },
  {
    "id": "level1-030",
    "chapter": 3,
    "stem": "AI 项目复盘中，以下哪项不是核心复盘维度？",
    "options": [
      "A. 目标达成情况",
      "B. 过程回顾",
      "C. 团队成员的私人生活",
      "D. 经验沉淀"
    ],
    "answer": "C",
    "analysis": "项目复盘的四个核心维度是：目标达成、过程回顾、经验沉淀和团队成长。团队成员的私人生活不属于项目复盘范畴。",
    "isKey": false
  }
]
