[
  {
    "id": "level4-001",
    "chapter": 1,
    "stem": "根据《中华人民共和国个人信息保护法》，处理个人信息应当遵循的最小必要原则是指什么？",
    "options": [
      "A. 只收集实现处理目的所必需的最少个人信息",
      "B. 处理个人信息需获得个人的明确同意",
      "C. 应采取安全措施保护个人信息安全",
      "D. 个人信息的处理目的应当明确具体"
    ],
    "answer": "A",
    "analysis": "最小必要原则的核心是只收集实现处理目的所必需的最少个人信息。B 是知情同意原则，C 是安全保护原则，D 是目的明确原则。PIPL 规定个人信息处理应遵循目的明确、最小必要、知情同意、安全保护四大原则。",
    "isKey": true
  },
  {
    "id": "level4-002",
    "chapter": 1,
    "stem": "下列哪项不属于《个人信息保护法》规定的敏感个人信息？",
    "options": [
      "A. 生物识别信息",
      "B. 宗教信仰信息",
      "C. 公开的新闻报道信息",
      "D. 行踪轨迹信息"
    ],
    "answer": "C",
    "analysis": "根据 PIPL，敏感个人信息包括生物识别、宗教信仰、特定身份、医疗健康、金融账户、行踪轨迹以及未成年人信息。公开的新闻报道信息不属于敏感个人信息。",
    "isKey": true
  },
  {
    "id": "level4-003",
    "chapter": 1,
    "stem": "数据标注人员发现训练数据中包含明显歧视性内容时，正确的处理方式是？",
    "options": [
      "A. 自行删除该部分数据",
      "B. 继续标注并私下记录",
      "C. 向项目负责人报告并记录问题",
      "D. 忽略该问题，按原计划完成标注"
    ],
    "answer": "C",
    "analysis": "根据职业伦理规范，发现数据中的偏见或问题时，标注人员应首先向项目负责人报告并记录问题，不擅自处理。自行删除或忽略都可能造成数据损失或伦理风险。",
    "isKey": true
  },
  {
    "id": "level4-004",
    "chapter": 1,
    "stem": "人工智能训练师在进行网络爬虫数据采集时，以下哪项行为是合规的？",
    "options": [
      "A. 突破网站的反爬措施采集数据",
      "B. 遵守目标网站的 robots.txt 规则",
      "C. 以高速率频繁请求目标网站",
      "D. 采集网站服务器内的所有数据"
    ],
    "answer": "B",
    "analysis": "合规爬虫应遵守 robots.txt 规则、服务条款，不突破反爬措施，设置合理的请求间隔。A（突破反爬）、C（高频请求干扰网站运行）、D（超出授权范围）均不合规。",
    "isKey": true
  },
  {
    "id": "level4-005",
    "chapter": 1,
    "stem": "数据安全法规定，重要数据需要进行什么管理？",
    "options": [
      "A. 公开共享",
      "B. 目录管理",
      "C. 跨境自由流动",
      "D. 无需特别管理"
    ],
    "answer": "B",
    "analysis": "《数据安全法》规定重要数据需进行目录管理，即建立重要数据目录，对目录内数据实施重点保护。A、C、D 均不符合数据安全法的规定。",
    "isKey": false
  },
  {
    "id": "level4-006",
    "chapter": 2,
    "stem": "下列缺失值类型中，哪种是指缺失值与缺失值本身有关（如低收入者不愿填写收入）？",
    "options": [
      "A. 完全随机缺失（MCAR）",
      "B. 随机缺失（MAR）",
      "C. 非随机缺失（MNAR）",
      "D. 系统缺失"
    ],
    "answer": "C",
    "analysis": "非随机缺失（MNAR，Missing Not At Random）是指缺失与缺失值本身有关的缺失类型。低收入者不愿填写收入是因为收入值本身较低，这就是 MNAR 的典型例子。MCAR 是缺失与任何值无关，MAR 是缺失与已观测值有关。",
    "isKey": true
  },
  {
    "id": "level4-007",
    "chapter": 2,
    "stem": "在 Pandas 中，删除指定列中含有缺失值的行，应使用以下哪个方法？",
    "options": [
      "A. df.dropna(subset=['列名'])",
      "B. df.fillna(0)",
      "C. df.drop_duplicates()",
      "D. df.isnull().sum()"
    ],
    "answer": "A",
    "analysis": "df.dropna(subset=['列名']) 用于删除指定列中含有缺失值的行。B 是填充缺失值，C 是删除重复值，D 是统计缺失值数量。",
    "isKey": true
  },
  {
    "id": "level4-008",
    "chapter": 2,
    "stem": "使用 IQR 法检测异常值时，异常值的判定范围是？",
    "options": [
      "A. 小于 Q1 - 1.5×IQR 或大于 Q3 + 1.5×IQR",
      "B. 小于均值 - 3×标准差",
      "C. 小于 Q1 - 3×IQR 或大于 Q3 + 3×IQR",
      "D. 小于最小值或大于最大值"
    ],
    "answer": "A",
    "analysis": "IQR 法的判定规则：下界 = Q1 - 1.5 × IQR，上界 = Q3 + 1.5 × IQR。超出此范围的值视为异常值。B 是 Z-Score 法的判定标准（3σ原则），C 的倍数不对，D 过于宽松。",
    "isKey": true
  },
  {
    "id": "level4-009",
    "chapter": 2,
    "stem": "某数据集有 10,000 条记录，其中 200 条存在重复。该数据集的重复数据率是多少？",
    "options": [
      "A. 2%",
      "B. 5%",
      "C. 10%",
      "D. 20%"
    ],
    "answer": "A",
    "analysis": "重复数据率 = 重复记录数 / 总记录数 × 100% = 200 / 10000 × 100% = 2%。A 选项正确。",
    "isKey": true
  },
  {
    "id": "level4-010",
    "chapter": 2,
    "stem": "数据质量评估中，'数据是否在多个来源间一致'对应的是哪个质量维度？",
    "options": [
      "A. 完整性",
      "B. 准确性",
      "C. 一致性",
      "D. 时效性"
    ],
    "answer": "C",
    "analysis": "一致性（Consistency）是指数据在多个来源或多个系统之间保持一致。A 完整性关注数据是否缺失，B 准确性关注数据是否正确，D 时效性关注数据是否在有效时间范围内。",
    "isKey": false
  },
  {
    "id": "level4-011",
    "chapter": 2,
    "stem": "以下哪种存储格式最适合大规模数据分析的列查询场景？",
    "options": [
      "A. CSV",
      "B. JSON",
      "C. Parquet",
      "D. XML"
    ],
    "answer": "C",
    "analysis": "Parquet 是列式存储格式，压缩率高，适合大规模数据分析中的列查询场景。CSV 是文本格式，查询效率低；JSON 支持嵌套但体积大；XML 标记严格但体积更大，都不适合大规模列查询。",
    "isKey": false
  },
  {
    "id": "level4-012",
    "chapter": 2,
    "stem": "在数据清洗流程中，处理格式标准化的内容不包括以下哪项？",
    "options": [
      "A. 统一日期时间格式",
      "B. 删除重复记录",
      "C. 统一分类枚举值",
      "D. 统一字符编码"
    ],
    "answer": "B",
    "analysis": "格式标准化包括统一日期时间格式、统一分类枚举值、统一字符编码等。删除重复记录属于重复值处理环节，不属于格式标准化。",
    "isKey": false
  },
  {
    "id": "level4-013",
    "chapter": 3,
    "stem": "在目标检测中，IoU（交并比）的计算公式是？",
    "options": [
      "A. 预测框与真实框的交集面积 / 预测框与真实框的并集面积",
      "B. 预测框与真实框的并集面积 / 预测框与真实框的交集面积",
      "C. 预测框面积 / 真实框面积",
      "D. 真实框面积 / 预测框面积"
    ],
    "answer": "A",
    "analysis": "IoU（Intersection over Union）是预测框与真实框的交集面积除以并集面积。IoU 值越接近 1 表示检测框越准确。通常 IoU ≥ 0.5 认为检测正确。",
    "isKey": true
  },
  {
    "id": "level4-014",
    "chapter": 3,
    "stem": "某目标检测模型在 100 张图片上检测，其中 TP=80，FP=20，FN=10。该模型的 Precision 是多少？",
    "options": [
      "A. 80%",
      "B. 75%",
      "C. 88.9%",
      "D. 66.7%"
    ],
    "answer": "A",
    "analysis": "Precision = TP / (TP + FP) = 80 / (80 + 20) = 80 / 100 = 80%。Recall = TP / (TP + FN) = 80 / 90 ≈ 88.9%。",
    "isKey": true
  },
  {
    "id": "level4-015",
    "chapter": 3,
    "stem": "在 NER（命名实体识别）标注中，'北京大学'的标注结果应该是？",
    "options": [
      "A. 北/B-ORG 京/I-ORG 大/B-ORG 学/I-ORG",
      "B. 北/B-ORG 京/I-ORG 大/O 学/O",
      "C. 北/B-LOC 京/I-LOC 大/B-LOC 学/I-LOC",
      "D. 北/O 京/O 大/O 学/O"
    ],
    "answer": "A",
    "analysis": "根据 BIO 标注方案，'北京大学'是一个机构实体（ORG），应以 B-ORG 开头，后续字符以 I-ORG 标注。不能出现 B-ORG 后接 I-LOC 的情况，同一实体的标签类型必须一致。",
    "isKey": true
  },
  {
    "id": "level4-016",
    "chapter": 3,
    "stem": "语义分割与目标检测的主要区别是？",
    "options": [
      "A. 语义分割是像素级标注，目标检测是矩形框级标注",
      "B. 语义分割只需标注类别，目标检测需要标注位置",
      "C. 语义分割比目标检测成本更低",
      "D. 两者没有本质区别"
    ],
    "answer": "A",
    "analysis": "语义分割需要对图像中的每个像素分配类别标签（像素级标注），而目标检测只需用边界框标注物体的位置和类别（矩形框级标注）。因此语义分割的标注成本和精度要求远高于目标检测。",
    "isKey": true
  },
  {
    "id": "level4-017",
    "chapter": 3,
    "stem": "在分类标注中，'多标签分类'与'多分类'的主要区别是？",
    "options": [
      "A. 多标签分类中一个样本可属于多个类别，多分类中一个样本只能属于一个类别",
      "B. 多标签分类只能用于文本，多分类只能用于图像",
      "C. 多标签分类不需要标注规范，多分类需要",
      "D. 两者没有区别"
    ],
    "answer": "A",
    "analysis": "多分类（Multi-class）中样本只能属于一个互斥类别，如猫/狗/鸟。多标签分类（Multi-label）中样本可同时属于多个非互斥类别，如图片中同时有'猫'和'室内'。",
    "isKey": false
  },
  {
    "id": "level4-018",
    "chapter": 3,
    "stem": "标注项目中，'三审流程'的正确顺序是？",
    "options": [
      "A. 自检 → 互检 → 终审",
      "B. 终审 → 互检 → 自检",
      "C. 互检 → 自检 → 终审",
      "D. 自检 → 终审 → 互检"
    ],
    "answer": "A",
    "analysis": "三审流程的正确顺序是：一审自检（标注员自查）→ 二审互检（另一标注员交叉检查）→ 三审终审（质检员抽检）。通过一审才能进入二审，通过二审才能进入终审。",
    "isKey": true
  },
  {
    "id": "level4-019",
    "chapter": 3,
    "stem": "Cohen's Kappa 系数用于评估什么？",
    "options": [
      "A. 标注人员之间的一致性",
      "B. 模型预测的准确率",
      "C. 数据集的完整性",
      "D. 标注工具的性能"
    ],
    "answer": "A",
    "analysis": "Cohen's Kappa 是衡量标注人员之间一致性的统计指标，考虑了随机一致性的影响。Kappa > 0.8 表示高度一致，0.6-0.8 表示中等一致。它用于评估多人标注同一数据集时的一致程度。",
    "isKey": false
  },
  {
    "id": "level4-020",
    "chapter": 3,
    "stem": "关于 Label Studio 和 CVAT 的对比，以下哪项说法是正确的？",
    "options": [
      "A. Label Studio 支持多模态标注，CVAT 专注计算机视觉",
      "B. CVAT 只能标注文本，Label Studio 只能标注图像",
      "C. Label Studio 是闭源商业软件，CVAT 是开源软件",
      "D. CVAT 不支持视频标注"
    ],
    "answer": "A",
    "analysis": "Label Studio 是开源多模态标注平台，支持文本、图像、音频等多种类型；CVAT 是计算机视觉专用的开源标注工具，专注图像和视频标注。两者都是开源软件，CVAT 支持视频标注。",
    "isKey": false
  },
  {
    "id": "level4-021",
    "chapter": 1,
    "stem": "根据《网络安全法》，网络运营者应当对收集的用户信息严格保密，并建立健全什么制度？",
    "options": [
      "A. 用户信息发布制度",
      "B. 用户信息保护制度",
      "C. 用户信息共享制度",
      "D. 用户信息删除制度"
    ],
    "answer": "B",
    "analysis": "《网络安全法》规定网络运营者应当对收集的用户信息严格保密，并建立健全用户信息保护制度。A、C、D 均不符合网络安全法的规定。",
    "isKey": false
  },
  {
    "id": "level4-022",
    "chapter": 2,
    "stem": "某数据集的年龄字段有 1000 条记录，其中 50 条缺失。若使用中位数填充法，首先需要做什么？",
    "options": [
      "A. 删除这 50 条缺失记录",
      "B. 计算非缺失记录年龄的中位数",
      "C. 将所有缺失值填为 0",
      "D. 使用众数填充"
    ],
    "answer": "B",
    "analysis": "使用中位数填充法时，首先需要计算非缺失记录中该字段的中位数，然后用这个中位数替代所有缺失值。中位数填充适用于数值型字段且数据分布可能有偏斜的情况。",
    "isKey": false
  },
  {
    "id": "level4-023",
    "chapter": 3,
    "stem": "当 IoU 阈值为 0.5 时，如果预测框与真实框的 IoU 为 0.6，则该检测结果是？",
    "options": [
      "A. 正确检测（TP）",
      "B. 错误检测（FP）",
      "C. 漏检（FN）",
      "D. 不确定"
    ],
    "answer": "A",
    "analysis": "当 IoU 大于等于阈值（0.5）时，认为预测框正确匹配了真实框，属于正确检测（TP，True Positive）。IoU = 0.6 > 0.5，因此是正确检测。",
    "isKey": false
  },
  {
    "id": "level4-024",
    "chapter": 3,
    "stem": "某标注项目的终检抽检 200 条数据，发现其中有 8 条标注错误。终检准确率是多少？",
    "options": [
      "A. 96%",
      "B. 94%",
      "C. 92%",
      "D. 90%"
    ],
    "answer": "A",
    "analysis": "终检准确率 = 正确记录数 / 总记录数 × 100% = (200 - 8) / 200 × 100% = 192 / 200 × 100% = 96%。",
    "isKey": false
  },
  {
    "id": "level4-025",
    "chapter": 2,
    "stem": "在数据清洗中，对日期时间字段进行格式标准化时，以下哪项不属于标准化内容？",
    "options": [
      "A. 统一为 YYYY-MM-DD 格式",
      "B. 处理时区差异",
      "C. 删除所有缺失日期的记录",
      "D. 统一日期分隔符"
    ],
    "answer": "C",
    "analysis": "格式标准化包括统一格式（如 YYYY-MM-DD）、处理时区、统一分隔符等。删除缺失记录属于缺失值处理，不属于格式标准化。",
    "isKey": false
  }
]
