[
  {"id":"je-001","chapter":1,"stem":"人民法院的性质是：","options":["A.行政机关","B.审判机关","C.法律监督机关","D.监察机关"],"answer":"B","analysis":"人民法院是国家审判机关。","isKey":true},
  {"id":"je-002","chapter":1,"stem":"上下级人民法院之间的关系是：","options":["A.领导关系","B.监督关系","C.指导关系","D.隶属关系"],"answer":"B","analysis":"上下级人民法院之间是监督关系，不是领导关系。","isKey":true},
  {"id":"je-003","chapter":1,"stem":"我国实行的审级制度是：","options":["A.一审终审","B.两审终审","C.三审终审","D.四审终审"],"answer":"B","analysis":"我国实行两审终审制。","isKey":true},
  {"id":"je-004","chapter":1,"stem":"不公开审理的情形不包括：","options":["A.涉及国家秘密","B.涉及个人隐私","C.涉及商业秘密","D.涉及未成年人犯罪"],"answer":"C","analysis":"不公开审理的情形包括涉及国家秘密、个人隐私、未成年人犯罪等。商业秘密可以不公开但不是必须。","isKey":true},
  {"id":"je-005","chapter":1,"stem":"当事人不服一审判决的上诉期限是：","options":["A.10日","B.15日","C.20日","D.30日"],"answer":"B","analysis":"当事人不服一审判决的上诉期限是15日。","isKey":true},
  {"id":"je-006","chapter":2,"stem":"人民检察院的性质是：","options":["A.审判机关","B.行政机关","C.法律监督机关","D.监察机关"],"answer":"C","analysis":"人民检察院是国家法律监督机关。","isKey":true},
  {"id":"je-007","chapter":2,"stem":"上下级人民检察院之间的关系是：","options":["A.领导关系","B.监督关系","C.指导关系","D.隶属关系"],"answer":"A","analysis":"上下级人民检察院之间是领导关系，与法院的监督关系不同。","isKey":true},
  {"id":"je-008","chapter":2,"stem":"检察院的职权不包括：","options":["A.批准逮捕","B.提起公诉","C.审判案件","D.诉讼监督"],"answer":"C","analysis":"审判案件是法院的职权，不是检察院的职权。","isKey":true},
  {"id":"je-009","chapter":3,"stem":"律师执业的实习期限是：","options":["A.6个月","B.1年","C.2年","D.3年"],"answer":"B","analysis":"律师需要在律师事务所实习满1年才能申请执业。","isKey":true},
  {"id":"je-010","chapter":3,"stem":"律师事务所的组织形式不包括：","options":["A.合伙律师事务所","B.个人律师事务所","C.国资律师事务所","D.股份制律师事务所"],"answer":"D","analysis":"律师事务所的组织形式包括合伙、个人和国资律师事务所。","isKey":true},
  {"id":"je-011","chapter":3,"stem":"律师的权利不包括：","options":["A.阅卷权","B.会见权","C.审判权","D.调查取证权"],"answer":"C","analysis":"审判权是法院的权力，不是律师的权利。","isKey":true},
  {"id":"je-012","chapter":3,"stem":"律师的义务不包括：","options":["A.遵守法律","B.保守秘密","C.双方代理","D.恪守职业道德"],"answer":"C","analysis":"双方代理是律师的禁止行为，不是义务。","isKey":true},
  {"id":"je-013","chapter":3,"stem":"法律援助的对象不包括：","options":["A.经济困难的公民","B.可能被判处死刑的被告人","C.所有犯罪嫌疑人","D.请求国家赔偿的公民"],"answer":"C","analysis":"法律援助有特定对象和范围，不是所有犯罪嫌疑人都可以获得法律援助。","isKey":true},
  {"id":"je-014","chapter":4,"stem":"公证机构的性质是：","options":["A.行政机关","B.司法机关","C.证明机构","D.营利性企业"],"answer":"C","analysis":"公证机构是依法设立的证明机构，不以营利为目的。","isKey":true},
  {"id":"je-015","chapter":4,"stem":"公证的效力不包括：","options":["A.证据效力","B.强制执行效力","C.立法效力","D.法律行为成立要件效力"],"answer":"C","analysis":"公证的效力包括证据效力、强制执行效力和法律行为成立要件效力。","isKey":true},
  {"id":"je-016","chapter":4,"stem":"公证员的年龄要求是：","options":["A.20周岁以上","B.23周岁以上","C.25周岁以上65周岁以下","D.30周岁以上"],"answer":"C","analysis":"公证员的年龄要求是25周岁以上65周岁以下。","isKey":true},
  {"id":"je-017","chapter":5,"stem":"法官职业道德的核心内容不包括：","options":["A.忠诚司法事业","B.保证司法公正","C.追求办案效率","D.确保司法廉洁"],"answer":"C","analysis":"追求办案效率不是法官职业道德的核心内容。","isKey":true},
  {"id":"je-018","chapter":5,"stem":"法官的回避决定中，院长的回避由谁决定？","options":["A.上级法院","B.审判委员会","C.本院其他法官","D.人大常委会"],"answer":"B","analysis":"院长担任审判长时的回避，由审判委员会决定。","isKey":true},
  {"id":"je-019","chapter":5,"stem":"法官的禁止行为不包括：","options":["A.私自会见当事人","B.收受贿赂","C.依法审判","D.泄露审判秘密"],"answer":"C","analysis":"依法审判是法官的职责，不是禁止行为。","isKey":true},
  {"id":"je-020","chapter":6,"stem":"检察官职业道德的核心内容不包括：","options":["A.忠诚","B.公正","C.效率","D.清廉"],"answer":"C","analysis":"检察官职业道德的核心内容包括忠诚、公正、清廉、文明。","isKey":true},
  {"id":"je-021","chapter":6,"stem":"律师执业的禁止行为不包括：","options":["A.私自接受委托","B.双方代理","C.依法辩护","D.收受贿赂"],"answer":"C","analysis":"依法辩护是律师的权利和职责，不是禁止行为。","isKey":true},
  {"id":"je-022","chapter":6,"stem":"律师与法官的关系要求不包括：","options":["A.尊重法官","B.不得向法官行贿","C.可以请法官吃饭","D.不得发表不当言论"],"answer":"C","analysis":"律师不得向法官行贿或请客送礼。","isKey":true},
  {"id":"je-023","chapter":1,"stem":"公开审判的例外情形不包括：","options":["A.涉及国家秘密","B.涉及个人隐私","C.涉及商业秘密","D.涉及未成年人犯罪"],"answer":"C","analysis":"涉及商业秘密可以不公开但不是必须不公开。必须不公开的是国家秘密、个人隐私、未成年人犯罪。","isKey":false},
  {"id":"je-024","chapter":2,"stem":"检察官的等级不包括：","options":["A.首席大检察官","B.大检察官","C.高级检察官","D.特级检察官"],"answer":"D","analysis":"检察官等级包括首席大检察官、大检察官、高级检察官、检察官。没有特级检察官。","isKey":true},
  {"id":"je-025","chapter":3,"stem":"不得从事律师职业的人员不包括：","options":["A.无民事行为能力人","B.受过刑事处罚的人","C.被开除公职的人","D.受过行政处罚的人"],"answer":"D","analysis":"受过行政处罚不是不得从事律师职业的条件。","isKey":true},
  {"id":"je-026","chapter":4,"stem":"公证业务范围不包括：","options":["A.证明合同","B.证明继承","C.审判案件","D.保全证据"],"answer":"C","analysis":"审判案件是法院的职权，不是公证业务。","isKey":true},
  {"id":"je-027","chapter":5,"stem":"法官的考核内容不包括：","options":["A.审判工作实绩","B.思想品德","C.家庭背景","D.审判业务水平"],"answer":"C","analysis":"法官考核内容包括审判工作实绩、思想品德、审判业务水平、工作态度等。不包括家庭背景。","isKey":true},
  {"id":"je-028","chapter":6,"stem":"律师的法律责任不包括：","options":["A.行政责任","B.民事责任","C.刑事责任","D.政治责任"],"answer":"D","analysis":"律师的法律责任包括行政责任、民事责任和刑事责任。不包括政治责任。","isKey":true},
  {"id":"je-029","chapter":1,"stem":"审判监督程序的提起主体不包括：","options":["A.各级法院院长","B.最高人民法院","C.当事人","D.律师"],"answer":"D","analysis":"审判监督程序的提起主体包括法院院长、最高法院、上级法院、当事人和检察院。律师不是独立的提起主体。","isKey":true},
  {"id":"je-030","chapter":2,"stem":"检察官的任职条件中，年龄要求是：","options":["A.年满20周岁","B.年满22周岁","C.年满23周岁","D.年满25周岁"],"answer":"C","analysis":"检察官的年龄要求是年满23周岁。","isKey":true},
  {"id":"je-031","chapter":3,"stem":"律师协会的性质是：","options":["A.行政机关","B.司法机关","C.自律性组织","D.营利性组织"],"answer":"C","analysis":"律师协会是律师的自律性组织，是社会团体法人。","isKey":true},
  {"id":"je-032","chapter":4,"stem":"公证员的禁止行为不包括：","options":["A.同时在两个以上公证机构执业","B.从事有报酬的其他职业","C.为本人办理公证","D.审查当事人身份"],"answer":"D","analysis":"审查当事人身份是公证员的职责，不是禁止行为。","isKey":true},
  {"id":"je-033","chapter":5,"stem":"法官回避的情形不包括：","options":["A.是本案当事人","B.与本案有利害关系","C.与当事人是同学","D.担任过本案证人"],"answer":"C","analysis":"与当事人是同学一般不是回避的理由，除非可能影响公正处理案件。","isKey":true},
  {"id":"je-034","chapter":6,"stem":"律师与对方当事人的关系要求是：","options":["A.可以与对方当事人恶意串通","B.不得损害对方当事人合法权益","C.可以收买对方当事人","D.可以威胁对方当事人"],"answer":"B","analysis":"律师不得损害对方当事人的合法权益。","isKey":true},
  {"id":"je-035","chapter":1,"stem":"我国法院的专门法院不包括：","options":["A.军事法院","B.海事法院","C.知识产权法院","D.行政法院"],"answer":"D","analysis":"我国没有独立的行政法院，行政案件由普通法院的行政审判庭审理。","isKey":true},
  {"id":"je-036","chapter":3,"stem":"合伙律师事务所的合伙人承担：","options":["A.有限责任","B.无限连带责任","C.无限责任","D.按份责任"],"answer":"B","analysis":"合伙律师事务所的合伙人承担无限连带责任。","isKey":true},
  {"id":"je-037","chapter":4,"stem":"经公证的法律行为的效力是：","options":["A.绝对有效","B.应当作为认定事实的根据","C.可以被任意推翻","D.没有法律效力"],"answer":"B","analysis":"经公证的法律行为应当作为认定事实的根据，但有相反证据足以推翻的除外。","isKey":true},
  {"id":"je-038","chapter":6,"stem":"律师职业道德的核心要求是：","options":["A.忠于法官","B.忠于当事人合法权益","C.忠于律师事务所","D.忠于律师协会"],"answer":"B","analysis":"律师应当忠于当事人的合法权益，尽职尽责维护当事人合法权益。","isKey":true},
  {"id":"je-039","chapter":2,"stem":"检察院的公益诉讼是指：","options":["A.为个人利益提起诉讼","B.为公共利益提起诉讼","C.为企业利益提起诉讼","D.为政府利益提起诉讼"],"answer":"B","analysis":"公益诉讼是为维护公共利益而提起的诉讼。","isKey":true},
  {"id":"je-040","chapter":5,"stem":"法官不得兼任的职务不包括：","options":["A.律师","B.企事业单位职务","C.人大代表","D.营利性经营活动"],"answer":"C","analysis":"法官可以兼任人大代表，但不得兼任律师、企事业单位职务，不得从事营利性经营活动。","isKey":true},
  {"id":"je-041","chapter":3,"stem":"律师的调查取证权是指：","options":["A.强制调查权","B.向有关单位或个人调查取证","C.搜查权","D.扣押权"],"answer":"B","analysis":"律师的调查取证权是向有关单位或个人调查取证，没有强制调查权。","isKey":true},
  {"id":"je-042","chapter":1,"stem":"审判委员会的职能是：","options":["A.审理所有案件","B.讨论决定重大疑难案件","C.代替法官审判","D.管理法院行政事务"],"answer":"B","analysis":"审判委员会的职能是讨论决定重大疑难案件和其他有关审判工作的问题。","isKey":true},
  {"id":"je-043","chapter":6,"stem":"律师保密义务的范围是：","options":["A.所有信息","B.国家秘密、商业秘密和当事人隐私","C.只有国家秘密","D.只有当事人隐私"],"answer":"B","analysis":"律师保密义务的范围包括国家秘密、商业秘密和当事人隐私。","isKey":true},
  {"id":"je-044","chapter":4,"stem":"公证机构可以设立在：","options":["A.县级以上行政区划","B.乡镇","C.省级以上行政区划","D.任何地方"],"answer":"A","analysis":"公证机构可以在县、不设区的市、设区的市、直辖市或者市辖区设立。","isKey":true},
  {"id":"je-045","chapter":2,"stem":"检察院的诉讼监督包括：","options":["A.刑事诉讼监督","B.民事诉讼监督","C.行政诉讼监督","D.以上都是"],"answer":"D","analysis":"检察院的诉讼监督包括刑事、民事、行政诉讼监督。","isKey":true},
  {"id":"je-046","chapter":5,"stem":"法官约束业外活动的目的是：","options":["A.限制法官自由","B.维护司法形象","C.减少法官收入","D.增加法官工作量"],"answer":"B","analysis":"法官约束业外活动的目的是维护司法形象和司法公信力。","isKey":true},
  {"id":"je-047","chapter":3,"stem":"律师不得在同一案件中为双方当事人代理，体现了：","options":["A.保密义务","B.忠诚义务","C.利益冲突回避","D.勤勉义务"],"answer":"C","analysis":"律师不得在同一案件中为双方当事人代理，体现了利益冲突回避原则。","isKey":true},
  {"id":"je-048","chapter":1,"stem":"使用本民族语言文字进行诉讼属于：","options":["A.审判工作的基本原则","B.检察工作的基本原则","C.律师执业的基本原则","D.以上都是"],"answer":"D","analysis":"使用本民族语言文字进行诉讼是审判、检察和律师执业共同遵守的基本原则。","isKey":true},
  {"id":"je-049","chapter":6,"stem":"律师公平竞争的要求是：","options":["A.可以贬低其他律师","B.不得进行虚假宣传","C.可以低价竞争","D.可以垄断市场"],"answer":"B","analysis":"律师之间应当公平竞争，不得进行虚假宣传。","isKey":true},
  {"id":"je-050","chapter":2,"stem":"检察官的回避制度适用于：","options":["A.法官","B.检察官","C.律师","D.公证员"],"answer":"B","analysis":"检察官的回避制度适用于检察官。","isKey":true}
]
