[
  {
    "id": "level5-001",
    "chapter": 1,
    "stem": "人工智能训练师职业道德的核心要求是（ ）。",
    "options": [
      "A. 爱岗敬业、诚实守信",
      "B. 保守秘密、严谨认真",
      "C. 诚实守信、保守秘密",
      "D. 办事公道、服务群众"
    ],
    "answer": "C",
    "analysis": "人工智能训练师职业道德的核心要求是诚实守信和保守秘密。由于标注工作涉及大量训练数据，保密性尤为重要；同时标注质量直接影响模型性能，因此诚实守信也是核心要求。",
    "isKey": true
  },
  {
    "id": "level5-002",
    "chapter": 1,
    "stem": "职业守则是职业活动中应遵循的（ ）。",
    "options": [
      "A. 道德规范",
      "B. 行为准则",
      "C. 法律法规",
      "D. 技术标准"
    ],
    "answer": "B",
    "analysis": "职业守则是职业活动中应遵循的行为准则，是具体的行为规范。职业道德是更宏观的准则，而职业守则是将职业道德具体化后的行为要求。",
    "isKey": true
  },
  {
    "id": "level5-003",
    "chapter": 1,
    "stem": "以下不属于职业守则内容的是（ ）。",
    "options": [
      "A. 遵守国家法律法规",
      "B. 保守工作秘密",
      "C. 提高薪资待遇",
      "D. 持续学习提高业务能力"
    ],
    "answer": "C",
    "analysis": "提高薪资待遇不属于职业守则内容。职业守则包括：遵守法律法规、遵守工作纪律、保守秘密、诚实守信、团结协作、持续学习、爱护公物等7条内容。",
    "isKey": false
  },
  {
    "id": "level5-004",
    "chapter": 1,
    "stem": "训练数据属于（ ），必须严格保密。",
    "options": [
      "A. 公开信息",
      "B. 敏感信息",
      "C. 一般数据",
      "D. 非保密信息"
    ],
    "answer": "B",
    "analysis": "训练数据属于敏感信息，涉及企业核心竞争力和客户隐私，必须严格保密。标注员不得将训练数据私自复制、传播或用于其他用途。",
    "isKey": true
  },
  {
    "id": "level5-005",
    "chapter": 1,
    "stem": "数据安全法要求数据处理者应当建立健全（ ）数据安全管理制度。",
    "options": [
      "A. 部分流程",
      "B. 关键环节",
      "C. 全流程",
      "D. 事后"
    ],
    "answer": "C",
    "analysis": "数据安全法要求数据处理者应当建立健全全流程数据安全管理制度，覆盖数据收集、存储、使用、加工、传输、提供、公开等各个环节。",
    "isKey": true
  },
  {
    "id": "level5-006",
    "chapter": 1,
    "stem": "个人信息保护法要求处理个人信息应当遵循（ ）原则。",
    "options": [
      "A. 合法、正当、必要",
      "B. 合法、正当、必要和诚信",
      "C. 公开、透明、公正",
      "D. 安全、高效、便捷"
    ],
    "answer": "B",
    "analysis": "个人信息保护法规定处理个人信息应当遵循合法、正当、必要和诚信原则。同时不得过度收集个人信息，任何个人有权查询、复制、更正、删除其个人信息。",
    "isKey": true
  },
  {
    "id": "level5-007",
    "chapter": 1,
    "stem": "以下关于标注数据的说法错误的是（ ）。",
    "options": [
      "A. 标注数据属于工作成果",
      "B. 标注数据可以随意分享给他人",
      "C. 标注数据涉及客户隐私",
      "D. 标注数据需要严格保密"
    ],
    "answer": "B",
    "analysis": "标注数据不可以随意分享给他人。标注数据属于敏感信息，涉及客户隐私和商业机密，必须严格保密。标注员不得将训练数据私自复制、传播或用于其他用途。",
    "isKey": false
  },
  {
    "id": "level5-008",
    "chapter": 2,
    "stem": "数据标注是指对原始数据进行（ ），使其成为机器学习可以理解的结构化数据的过程。",
    "options": [
      "A. 删除和过滤",
      "B. 加工处理和添加标签",
      "C. 压缩和加密",
      "D. 复制和备份"
    ],
    "answer": "B",
    "analysis": "数据标注是指对原始数据进行加工处理，添加标签、分类或注释，使其成为机器学习算法可以理解的结构化数据的过程。这是AI模型训练的基础环节。",
    "isKey": true
  },
  {
    "id": "level5-009",
    "chapter": 2,
    "stem": "以下哪项不是数据标注的目的？（ ）",
    "options": [
      "A. 为机器学习模型提供训练数据",
      "B. 帮助模型学习数据特征与标签的映射关系",
      "C. 提高模型的准确性和泛化能力",
      "D. 减少模型训练所需的计算资源"
    ],
    "answer": "D",
    "analysis": "减少模型训练所需的计算资源不是数据标注的目的。数据标注的主要目的是为机器学习模型提供训练数据，帮助模型学习特征与标签之间的映射关系，提高模型准确性和泛化能力。",
    "isKey": false
  },
  {
    "id": "level5-010",
    "chapter": 2,
    "stem": "以下属于文本标注类型的是（ ）。",
    "options": [
      "A. 图像分类",
      "B. 目标检测",
      "C. 情感分析",
      "D. 语音转写"
    ],
    "answer": "C",
    "analysis": "情感分析属于文本标注类型，用于判断文本的情感倾向（正面/负面/中性）。图像分类和目标检测属于图像标注，语音转写属于语音标注。",
    "isKey": true
  },
  {
    "id": "level5-011",
    "chapter": 2,
    "stem": "以下属于图像标注类型的是（ ）。",
    "options": [
      "A. 文本分类",
      "B. 目标检测",
      "C. 语义相似度",
      "D. 语音切割"
    ],
    "answer": "B",
    "analysis": "目标检测属于图像标注类型，用于在图像中用矩形框标注目标的位置。文本分类和语义相似度属于文本标注，语音切割属于语音标注。",
    "isKey": true
  },
  {
    "id": "level5-012",
    "chapter": 2,
    "stem": "将语音内容转换为文字的过程称为（ ）。",
    "options": [
      "A. 语音分类",
      "B. 语音转写",
      "C. 语音增强",
      "D. 语音合成"
    ],
    "answer": "B",
    "analysis": "语音转写是将语音内容转换为文字的过程，是语音标注中最常见的类型。语音合成是将文字转换为语音，语音增强是改善语音质量，语音分类是对语音进行分类。",
    "isKey": true
  },
  {
    "id": "level5-013",
    "chapter": 2,
    "stem": "数据标注流程的第一步是（ ）。",
    "options": [
      "A. 正式标注",
      "B. 理解标注规范",
      "C. 接收任务",
      "D. 自我检查"
    ],
    "answer": "C",
    "analysis": "数据标注流程的第一步是接收任务，获取标注任务和标注规范。后续步骤依次为理解规范、试标练习、正式标注、自我检查、提交审核、反馈修正。",
    "isKey": true
  },
  {
    "id": "level5-014",
    "chapter": 2,
    "stem": "标注质量三要素不包括（ ）。",
    "options": [
      "A. 准确性",
      "B. 一致性",
      "C. 完整性",
      "D. 时效性"
    ],
    "answer": "D",
    "analysis": "标注质量三要素是准确性、一致性和完整性，不包括时效性。准确性指标注结果正确，一致指标注标准统一，完整性指标注无遗漏。",
    "isKey": true
  },
  {
    "id": "level5-015",
    "chapter": 2,
    "stem": "同一标注员对不同样本的标注标准应统一，这属于标注质量的（ ）。",
    "options": [
      "A. 准确性",
      "B. 一致性",
      "C. 完整性",
      "D. 规范性"
    ],
    "answer": "B",
    "analysis": "一致性要求同一标注员对不同样本的标注标准应统一，不同标注员对相同样本的标注结果应一致。准确性指标注结果正确，完整性指标注无遗漏。",
    "isKey": true
  },
  {
    "id": "level5-016",
    "chapter": 2,
    "stem": "以下哪种情况属于漏标？（ ）",
    "options": [
      "A. 标注了错误的内容",
      "B. 应该标注的内容未被标注",
      "C. 标注格式不符合要求",
      "D. 相同内容标注结果不一"
    ],
    "answer": "B",
    "analysis": "漏标是指应该标注的内容未被标注。错标是标注了不应标注的内容，标错是标注了正确位置但标签错误，不规范是标注格式不符合要求。",
    "isKey": false
  },
  {
    "id": "level5-017",
    "chapter": 3,
    "stem": "在Word中，保存文档的快捷键是（ ）。",
    "options": [
      "A. Ctrl+O",
      "B. Ctrl+S",
      "C. Ctrl+N",
      "D. Ctrl+P"
    ],
    "answer": "B",
    "analysis": "在Word中，Ctrl+S是保存文档的快捷键。Ctrl+O是打开文档，Ctrl+N是新建文档，Ctrl+P是打印文档。",
    "isKey": true
  },
  {
    "id": "level5-018",
    "chapter": 3,
    "stem": "在Excel中，计算A1到A10单元格之和的函数是（ ）。",
    "options": [
      "A. =AVERAGE(A1:A10)",
      "B. =MAX(A1:A10)",
      "C. =SUM(A1:A10)",
      "D. =MIN(A1:A10)"
    ],
    "answer": "C",
    "analysis": "SUM函数用于求和，=SUM(A1:A10)计算A1到A10的和。AVERAGE计算平均值，MAX计算最大值，MIN计算最小值。",
    "isKey": true
  },
  {
    "id": "level5-019",
    "chapter": 3,
    "stem": "以下哪种是Excel文件类型的扩展名？（ ）",
    "options": [
      "A. .txt",
      "B. .docx",
      "C. .xlsx",
      "D. .pdf"
    ],
    "answer": "C",
    "analysis": ".xlsx是Excel文件类型的扩展名。.txt是文本文件，.docx是Word文档，.pdf是PDF文档。",
    "isKey": true
  },
  {
    "id": "level5-020",
    "chapter": 3,
    "stem": "在Windows中，打开\"运行\"对话框的快捷键是（ ）。",
    "options": [
      "A. Win+R",
      "B. Win+L",
      "C. Alt+Tab",
      "D. Ctrl+Shift+Esc"
    ],
    "answer": "A",
    "analysis": "Win+R打开\"运行\"对话框，用于快速运行程序。Win+L锁定计算机，Alt+Tab切换窗口，Ctrl+Shift+Esc打开任务管理器。",
    "isKey": true
  },
  {
    "id": "level5-021",
    "chapter": 3,
    "stem": "在浏览器中，查看网页源代码应使用的快捷键是（ ）。",
    "options": [
      "A. Ctrl+F",
      "B. Ctrl+S",
      "C. F12",
      "D. F5"
    ],
    "answer": "C",
    "analysis": "F12打开开发者工具，可以查看网页源代码、调试JavaScript等。Ctrl+F在页面内查找，Ctrl+S保存网页，F5刷新页面。",
    "isKey": true
  },
  {
    "id": "level5-022",
    "chapter": 3,
    "stem": "以下关于文件操作的说法错误的是（ ）。",
    "options": [
      "A. Delete键删除的文件进入回收站",
      "B. Shift+Delete永久删除文件",
      "C. 复制文件使用Ctrl+X",
      "D. 重命名文件可使用F2"
    ],
    "answer": "C",
    "analysis": "复制文件使用Ctrl+C，Ctrl+X是剪切。Delete删除的文件进入回收站，Shift+Delete永久删除（不经过回收站），F2可以重命名文件。",
    "isKey": true
  },
  {
    "id": "level5-023",
    "chapter": 2,
    "stem": "标注工作完成后，标注员应首先进行（ ），确保标注结果准确无误后再提交。",
    "options": [
      "A. 提交审核",
      "B. 自我检查",
      "C. 重新标注",
      "D. 请示领导"
    ],
    "answer": "B",
    "analysis": "标注工作完成后，标注员应首先进行自我检查，确保标注结果准确无误后再提交审核。自我检查是标注流程中的重要环节，可以减少后续返工。",
    "isKey": true
  },
  {
    "id": "level5-024",
    "chapter": 1,
    "stem": "以下哪项不属于人工智能训练师的职业道德要求？（ ）",
    "options": [
      "A. 严格按照标注规范执行任务",
      "B. 不得擅自修改、泄露训练数据",
      "C. 对标注结果负责，确保准确性和一致性",
      "D. 尽量多标注以获得更高报酬"
    ],
    "answer": "D",
    "analysis": "尽量多标注以获得更高报酬不属于职业道德要求。人工智能训练师应严格按照标注规范执行任务，确保标注质量，而不是一味追求数量。",
    "isKey": false
  }
]
