[
  {"id":"civilproc-001","chapter":1,"stem":"下列哪项不属于民事诉讼法的基本原则？","options":["A.当事人诉讼权利平等原则","B.辩论原则","C.罪刑法定原则","D.处分原则"],"answer":"C","analysis":"罪刑法定原则是刑法的基本原则。","isKey":true},
  {"id":"civilproc-002","chapter":2,"stem":"合同纠纷的管辖法院是：","options":["A.只能由被告住所地法院管辖","B.只能由合同履行地法院管辖","C.由被告住所地或合同履行地法院管辖","D.由原告住所地法院管辖"],"answer":"C","analysis":"合同纠纷由被告住所地或者合同履行地人民法院管辖。","isKey":true},
  {"id":"civilproc-003","chapter":2,"stem":"不动产纠纷由哪个法院管辖？","options":["A.被告住所地法院","B.原告住所地法院","C.不动产所在地法院","D.合同签订地法院"],"answer":"C","analysis":"不动产纠纷由不动产所在地人民法院专属管辖。","isKey":true},
  {"id":"civilproc-004","chapter":3,"stem":"甲起诉乙要求偿还借款，丙认为借款是自己借给乙的。丙应当以什么身份参加诉讼？","options":["A.原告","B.被告","C.有独立请求权第三人","D.无独立请求权第三人"],"answer":"C","analysis":"丙对诉讼标的有独立请求权，应当以有独立请求权第三人的身份参加诉讼。","isKey":true},
  {"id":"civilproc-005","chapter":4,"stem":"民事诉讼中，证明责任的一般规则是：","options":["A.被告举证","B.原告举证","C.谁主张谁举证","D.法院举证"],"answer":"C","analysis":"民事诉讼中，证明责任的一般规则是谁主张谁举证。","isKey":true},
  {"id":"civilproc-006","chapter":5,"stem":"诉前财产保全应当：","options":["A.不需要提供担保","B.必须提供担保","C.可以提供担保","D.由法院决定是否提供担保"],"answer":"B","analysis":"诉前财产保全应当提供担保。","isKey":true},
  {"id":"civilproc-007","chapter":6,"stem":"人民法院适用普通程序审理的案件，审理期限为：","options":["A.3个月","B.6个月","C.1年","D.2年"],"answer":"B","analysis":"人民法院适用普通程序审理的案件，应当在立案之日起6个月内审结。","isKey":true},
  {"id":"civilproc-008","chapter":6,"stem":"简易程序适用于：","options":["A.所有民事案件","B.基层人民法院审理的事实清楚、权利义务关系明确、争议不大的案件","C.中级人民法院审理的案件","D.高级人民法院审理的案件"],"answer":"B","analysis":"简易程序适用于基层人民法院审理事实清楚、权利义务关系明确、争议不大的简单的民事案件。","isKey":true},
  {"id":"civilproc-009","chapter":7,"stem":"当事人不服一审判决的上诉期限为：","options":["A.10日","B.15日","C.30日","D.60日"],"answer":"B","analysis":"当事人不服一审判决的上诉期限为15日。","isKey":true},
  {"id":"civilproc-010","chapter":8,"stem":"当事人申请再审的期限为：","options":["A.判决生效后3个月内","B.判决生效后6个月内","C.判决生效后1年内","D.没有期限限制"],"answer":"B","analysis":"当事人申请再审，应当在判决、裁定发生法律效力后6个月内提出。","isKey":true},
  {"id":"civilproc-011","chapter":9,"stem":"案外人对执行标的提出异议，人民法院应当在多长时间内审查？","options":["A.7日","B.15日","C.30日","D.60日"],"answer":"B","analysis":"人民法院应当自收到书面异议之日起15日内审查。","isKey":true},
  {"id":"civilproc-012","chapter":10,"stem":"下列关于仲裁协议的说法，正确的是：","options":["A.仲裁协议必须以口头形式订立","B.仲裁协议独立存在，合同无效不影响仲裁协议的效力","C.当事人达成仲裁协议后不能向法院起诉","D.仲裁协议没有法律效力"],"answer":"B","analysis":"仲裁协议独立存在，合同的变更、解除、终止或者无效，不影响仲裁协议的效力。","isKey":true},
  {"id":"civilproc-013","chapter":10,"stem":"仲裁裁决的生效时间是：","options":["A.作出之日","B.送达之日","C.申请执行之日","D.当事人签收之日"],"answer":"A","analysis":"裁决书自作出之日起发生法律效力。","isKey":true},
  {"id":"civilproc-014","chapter":11,"stem":"诉讼调解的原则不包括：","options":["A.自愿原则","B.合法原则","C.公开原则","D.公平原则"],"answer":"C","analysis":"诉讼调解遵循自愿原则和合法原则。","isKey":true},
  {"id":"civilproc-015","chapter":12,"stem":"涉外民事诉讼中，被告提出答辩状的期限为：","options":["A.15日","B.30日","C.60日","D.90日"],"answer":"B","analysis":"涉外民事诉讼中，被告应当在收到起诉状副本后30日内提出答辩状。","isKey":true},
  {"id":"civilproc-016","chapter":2,"stem":"协议管辖不得违反：","options":["A.级别管辖和专属管辖","B.地域管辖","C.移送管辖","D.指定管辖"],"answer":"A","analysis":"协议管辖不得违反级别管辖和专属管辖的规定。","isKey":true},
  {"id":"civilproc-017","chapter":4,"stem":"下列属于民事诉讼证据种类的是：","options":["A.当事人陈述","B.推定","C.自认","D.司法认知"],"answer":"A","analysis":"当事人陈述是民事诉讼证据的种类之一。","isKey":true},
  {"id":"civilproc-018","chapter":6,"stem":"小额诉讼实行：","options":["A.两审终审","B.一审终审","C.三审终审","D.没有审级限制"],"answer":"B","analysis":"小额诉讼实行一审终审。","isKey":true},
  {"id":"civilproc-019","chapter":7,"stem":"二审法院对上诉案件的审理方式是：","options":["A.只能开庭审理","B.只能书面审理","C.可以开庭审理或径行判决","D.必须调解"],"answer":"C","analysis":"二审法院可以开庭审理，也可以径行判决、裁定。","isKey":true},
  {"id":"civilproc-020","chapter":10,"stem":"仲裁庭的组成可以是：","options":["A.只能由1名仲裁员组成","B.只能由3名仲裁员组成","C.由1名或3名仲裁员组成","D.由5名仲裁员组成"],"answer":"C","analysis":"仲裁庭可以由3名仲裁员或者1名仲裁员组成。","isKey":true},
  {"id":"civilproc-021","chapter":2,"stem":"因侵权行为提起的诉讼，由哪个法院管辖？","options":["A.只能由侵权行为地法院管辖","B.只能由被告住所地法院管辖","C.由侵权行为地或被告住所地法院管辖","D.由原告住所地法院管辖"],"answer":"C","analysis":"因侵权行为提起的诉讼，由侵权行为地或者被告住所地人民法院管辖。","isKey":true},
  {"id":"civilproc-022","chapter":5,"stem":"先予执行的情形不包括：","options":["A.追索赡养费","B.追索劳动报酬","C.追索货款","D.追索医疗费用"],"answer":"C","analysis":"追索货款不属于先予执行的情形。","isKey":true},
  {"id":"civilproc-023","chapter":6,"stem":"起诉的条件不包括：","options":["A.原告与本案有直接利害关系","B.有明确的被告","C.有具体的诉讼请求","D.必须有律师代理"],"answer":"D","analysis":"起诉不要求必须有律师代理。","isKey":true},
  {"id":"civilproc-024","chapter":8,"stem":"再审的提起方式不包括：","options":["A.当事人申请再审","B.人民检察院抗诉","C.人民法院决定再审","D.公安机关建议"],"answer":"D","analysis":"公安机关不能建议再审。","isKey":true},
  {"id":"civilproc-025","chapter":10,"stem":"仲裁协议的无效情形不包括：","options":["A.约定的仲裁事项超出仲裁范围","B.无民事行为能力人订立的仲裁协议","C.口头形式的仲裁协议","D.一方采取胁迫手段订立的仲裁协议"],"answer":"C","analysis":"仲裁协议的无效情形不包括口头形式。","isKey":true},
  {"id":"civilproc-026","chapter":3,"stem":"必要共同诉讼的特征是：","options":["A.诉讼标的是同一种类","B.诉讼标的是共同的","C.诉讼标的是不同的","D.诉讼标的没有关联"],"answer":"B","analysis":"必要共同诉讼的诉讼标的是共同的。","isKey":true},
  {"id":"civilproc-027","chapter":7,"stem":"二审法院对裁定的上诉案件的审理期限为：","options":["A.15日","B.30日","C.3个月","D.6个月"],"answer":"B","analysis":"二审法院对裁定的上诉案件，应当在30日内作出终审裁定。","isKey":true},
  {"id":"civilproc-028","chapter":9,"stem":"执行措施不包括：","options":["A.查询、冻结、划拨存款","B.扣留、提取收入","C.查封、扣押财产","D.行政拘留"],"answer":"D","analysis":"行政拘留不是民事诉讼的执行措施。","isKey":true},
  {"id":"civilproc-029","chapter":10,"stem":"撤销仲裁裁决的申请应当向哪个法院提出？","options":["A.基层人民法院","B.中级人民法院","C.高级人民法院","D.最高人民法院"],"answer":"B","analysis":"当事人可以向仲裁委员会所在地的中级人民法院申请撤销裁决。","isKey":true},
  {"id":"civilproc-030","chapter":1,"stem":"两审终审制度是指：","options":["A.一个案件经过两级法院审理后即告终结","B.一个案件经过三级法院审理后即告终结","C.一个案件只能审理一次","D.一个案件可以多次审理"],"answer":"A","analysis":"两审终审制度是指一个民事案件经过两级人民法院审理后即告终结。","isKey":true}
]
