[
  {"id":"jur-001","chapter":1,"stem":"法的本质最终决定于：","options":["A.统治阶级意志","B.国家意志","C.社会物质生活条件","D.自然规律"],"answer":"C","analysis":"马克思主义法学认为，法的内容最终决定于社会物质生活条件。","isKey":true},
  {"id":"jur-002","chapter":1,"stem":"下列属于法的特征的是：","options":["A.法依靠舆论保证实施","B.法具有国家强制性","C.法不具有普遍性","D.法与道德完全相同"],"answer":"B","analysis":"法以国家强制力保证实施，这是法的重要特征。道德依靠舆论保证实施。","isKey":true},
  {"id":"jur-003","chapter":1,"stem":"法律规则的逻辑结构包括：","options":["A.权利、义务、责任","B.假定条件、行为模式、法律后果","C.主体、客体、内容","D.制定、执行、适用"],"answer":"B","analysis":"法律规则的逻辑结构包括假定条件、行为模式和法律后果三部分。","isKey":true},
  {"id":"jur-004","chapter":1,"stem":"授权性规则和义务性规则的分类标准是：","options":["A.规则的内容规定不同","B.规则的确定性程度不同","C.规则的强制性程度不同","D.规则的适用范围不同"],"answer":"A","analysis":"按照规则的内容规定不同，法律规则分为授权性规则和义务性规则。","isKey":false},
  {"id":"jur-005","chapter":1,"stem":"法律原则与法律规则的区别在于：","options":["A.原则明确具体，规则宽泛抽象","B.规则以全有或全无的方式适用，原则不是","C.原则冲突时一个无效，规则冲突时权衡适用","D.原则和规则完全相同"],"answer":"B","analysis":"法律规则以全有或全无的方式适用，法律原则不是。规则冲突时一个无效，原则冲突时权衡适用。","isKey":true},
  {"id":"jur-006","chapter":1,"stem":"法的指引作用的对象是：","options":["A.他人的行为","B.本人的行为","C.一般人的行为","D.违法犯罪者"],"answer":"B","analysis":"法的指引作用的对象是本人的行为，是对本人行为的引导。","isKey":true},
  {"id":"jur-007","chapter":1,"stem":"法的评价作用的对象是：","options":["A.本人的行为","B.他人的行为","C.一般人的行为","D.违法犯罪者"],"answer":"B","analysis":"法的评价作用的对象是他人的行为，是衡量他人行为合法与否的标准。","isKey":false},
  {"id":"jur-008","chapter":1,"stem":"根本法与普通法的分类标准是：","options":["A.创制和适用主体","B.法律规定的内容","C.法律地位、效力、内容和制定程序","D.法律的创制方式和表现形式"],"answer":"C","analysis":"根本法与普通法是根据法律的地位、效力、内容和制定程序的不同进行的分类。","isKey":false},
  {"id":"jur-009","chapter":2,"stem":"我国的立法体制是：","options":["A.集中统一的立法体制","B.分散的立法体制","C.统一而又分层次的立法体制","D.三权分立的立法体制"],"answer":"C","analysis":"我国实行统一而又分层次的立法体制，全国人大及其常委会行使国家立法权。","isKey":true},
  {"id":"jur-010","chapter":2,"stem":"执法与司法的主要区别不包括：","options":["A.主体不同","B.内容不同","C.程序性要求不同","D.都有强制性"],"answer":"D","analysis":"执法和司法都有强制性，这不是它们的区别。主要区别在于主体、内容、程序性、主动性等方面。","isKey":false},
  {"id":"jur-011","chapter":2,"stem":"司法的基本原则不包括：","options":["A.司法公正原则","B.公民在法律面前一律平等","C.以事实为根据以法律为准绳","D.效率优先原则"],"answer":"D","analysis":"司法的基本原则包括司法公正、法律面前人人平等、以事实为根据以法律为准绳、司法独立。不包括效率优先。","isKey":true},
  {"id":"jur-012","chapter":2,"stem":"法律监督体系中，属于国家监督的是：","options":["A.政党的监督","B.社会组织的监督","C.权力机关的监督","D.舆论的监督"],"answer":"C","analysis":"国家监督包括权力机关、行政机关、司法机关的监督。政党和社会组织的监督属于社会监督。","isKey":true},
  {"id":"jur-013","chapter":3,"stem":"马克思主义法学认为法的产生根源是：","options":["A.神的意志","B.社会契约","C.物质生活条件","D.绝对精神"],"answer":"C","analysis":"马克思主义法学认为法最终决定于社会物质生活条件。","isKey":true},
  {"id":"jur-014","chapter":3,"stem":"大陆法系与英美法系的主要区别在于：","options":["A.法律渊源不同","B.法律效力不同","C.法律概念不同","D.法律目的不同"],"answer":"A","analysis":"大陆法系以成文法为主，英美法系以判例法为主，法律渊源是主要区别。","isKey":true},
  {"id":"jur-015","chapter":3,"stem":"下列属于英美法系的国家是：","options":["A.法国","B.德国","C.日本","D.英国"],"answer":"D","analysis":"英国、美国、澳大利亚、加拿大等属于英美法系。法国、德国属于大陆法系。","isKey":false},
  {"id":"jur-016","chapter":4,"stem":"法与道德的区别不包括：","options":["A.产生方式不同","B.表现形式不同","C.调整范围相同","D.实现手段不同"],"answer":"C","analysis":"法与道德的调整范围不同，法只调整外在行为，道德既调整内心也调整外在行为。","isKey":true},
  {"id":"jur-017","chapter":4,"stem":"经济基础对法的作用是：","options":["A.决定作用","B.反作用","C.没有作用","D.阻碍作用"],"answer":"A","analysis":"经济基础决定法，法对经济基础有反作用。","isKey":true},
  {"id":"jur-018","chapter":5,"stem":"法律关系的构成要素包括：","options":["A.权利、义务、责任","B.主体、客体、内容","C.规范、事实、关系","D.立法、执法、司法"],"answer":"B","analysis":"法律关系由主体、客体和内容（权利和义务）三个要素构成。","isKey":true},
  {"id":"jur-019","chapter":5,"stem":"下列属于法律事件的是：","options":["A.签订合同","B.立遗嘱","C.自然灾害","D.犯罪行为"],"answer":"C","analysis":"法律事件是与当事人意志无关的客观事实，自然灾害属于法律事件。","isKey":true},
  {"id":"jur-020","chapter":5,"stem":"法律关系客体不包括：","options":["A.物","B.行为","C.智力成果","D.思想"],"answer":"D","analysis":"法律关系客体包括物、行为、智力成果、人身利益等，思想不能成为法律关系的客体。","isKey":true},
  {"id":"jur-021","chapter":5,"stem":"权利与义务的关系是：","options":["A.互相独立","B.相互依存","C.权利比义务重要","D.义务比权利重要"],"answer":"B","analysis":"权利和义务相互依存，没有无义务的权利，也没有无权利的义务。","isKey":true},
  {"id":"jur-022","chapter":6,"stem":"法律责任的归责原则不包括：","options":["A.责任法定原则","B.因果联系原则","C.推定过错原则","D.责任相当原则"],"answer":"C","analysis":"归责原则包括责任法定、因果联系、责任相当、责任自负。推定过错不是归责原则。","isKey":true},
  {"id":"jur-023","chapter":6,"stem":"下列属于免责事由的是：","options":["A.时效免责","B.主观无过错","C.行为合法","D.未造成损害"],"answer":"A","analysis":"时效免责是指超过法定追诉时效可以免除法律责任。","isKey":true},
  {"id":"jur-024","chapter":6,"stem":"正当防卫免责属于：","options":["A.时效免责","B.自助免责","C.法定免责","D.协议免责"],"answer":"C","analysis":"正当防卫是法律规定的免责事由，属于法定免责。","isKey":false},
  {"id":"jur-025","chapter":7,"stem":"将'武器'解释为包括枪支弹药，属于：","options":["A.字面解释","B.扩大解释","C.限制解释","D.类推解释"],"answer":"B","analysis":"将武器的含义扩大到包括枪支弹药，属于扩大解释。","isKey":true},
  {"id":"jur-026","chapter":7,"stem":"我国法律解释权属于：","options":["A.最高人民法院","B.最高人民检察院","C.全国人大常委会","D.国务院"],"answer":"C","analysis":"根据《立法法》规定，法律解释权属于全国人民代表大会常务委员会。","isKey":true},
  {"id":"jur-027","chapter":7,"stem":"法律解释中最基本的方法是：","options":["A.体系解释","B.历史解释","C.文义解释","D.目的解释"],"answer":"C","analysis":"文义解释（语法解释）是最基本、最常用的法律解释方法。","isKey":true},
  {"id":"jur-028","chapter":7,"stem":"司法解释的主体是：","options":["A.全国人大常委会","B.最高人民法院和最高人民检察院","C.国务院","D.司法部"],"answer":"B","analysis":"司法解释的主体是最高人民法院和最高人民检察院。","isKey":true},
  {"id":"jur-029","chapter":8,"stem":"演绎推理的结构是：","options":["A.从个别到一般","B.从一般到个别","C.从个别到个别","D.从结果到原因"],"answer":"B","analysis":"演绎推理是从一般到个别的推理，即从法律规范（一般）到具体案件（个别）。","isKey":true},
  {"id":"jur-030","chapter":8,"stem":"'张三偷了东西受罚，李四偷了东西受罚，所以偷东西的人都会受罚'属于：","options":["A.演绎推理","B.归纳推理","C.类比推理","D.设证推理"],"answer":"B","analysis":"从多个个别案例推导出一般结论，属于归纳推理。","isKey":true},
  {"id":"jur-031","chapter":8,"stem":"演绎推理的大前提是：","options":["A.案件事实","B.法律规范","C.法律决定","D.法律原则"],"answer":"B","analysis":"演绎推理中，大前提是法律规范，小前提是案件事实，结论是法律决定。","isKey":true},
  {"id":"jur-032","chapter":8,"stem":"从结果出发推测原因的推理是：","options":["A.演绎推理","B.归纳推理","C.类比推理","D.设证推理"],"answer":"D","analysis":"设证推理是从结果出发推测原因的推理，是一种或然性推理。","isKey":false},
  {"id":"jur-033","chapter":9,"stem":"法治与法制的根本区别在于：","options":["A.字数不同","B.法治必然与民主相联系","C.法治是法律制度的简称","D.法制必然与民主相联系"],"answer":"B","analysis":"法治必然与民主相联系，法制不一定与民主相联系，这是根本区别。","isKey":true},
  {"id":"jur-034","chapter":9,"stem":"社会主义法治的基本要求是：","options":["A.有法可依、有法必依、执法必严、违法必究","B.科学立法、严格执法、公正司法、全民守法","C.法律至上、权力制约、权利保障、正当程序","D.民主立法、依法行政、公正司法、全民守法"],"answer":"A","analysis":"社会主义法治的基本要求是'有法可依、有法必依、执法必严、违法必究'十六字方针。","isKey":true},
  {"id":"jur-035","chapter":9,"stem":"法治的核心要素不包括：","options":["A.法律至上","B.权力制约","C.权力集中","D.正当程序"],"answer":"C","analysis":"法治的核心要素包括法律至上、权力制约、权利保障、正当程序。权力集中与法治相悖。","isKey":true},
  {"id":"jur-036","chapter":10,"stem":"法律的基础价值是：","options":["A.自由","B.正义","C.秩序","D.效率"],"answer":"C","analysis":"秩序是法律的基础价值，法律的其他价值都以秩序价值为基础。","isKey":true},
  {"id":"jur-037","chapter":10,"stem":"法律价值的位阶顺序一般是：","options":["A.秩序>正义>自由","B.自由>正义>秩序","C.正义>自由>秩序","D.效率>自由>正义"],"answer":"B","analysis":"一般认为法律价值的位阶顺序是：自由>正义>秩序。","isKey":true},
  {"id":"jur-038","chapter":10,"stem":"实体正义是指：","options":["A.过程的正义","B.程序的正义","C.结果的正义","D.形式的正义"],"answer":"C","analysis":"实体正义是指结果的正义，即权利义务分配的公正。程序正义是指过程的正义。","isKey":true},
  {"id":"jur-039","chapter":1,"stem":"法的强制作用的对象是：","options":["A.本人的行为","B.他人的行为","C.违法犯罪者","D.一般人"],"answer":"C","analysis":"法的强制作用的对象是违法犯罪者，是对违法犯罪行为的制裁。","isKey":false},
  {"id":"jur-040","chapter":2,"stem":"狭义的执法是指：","options":["A.国家行政机关的执法活动","B.司法机关的活动","C.所有国家机关的活动","D.社会组织的活动"],"answer":"A","analysis":"狭义的执法仅指国家行政机关的执法活动。","isKey":true},
  {"id":"jur-041","chapter":4,"stem":"法对经济基础的作用是：","options":["A.决定作用","B.反作用","C.没有作用","D.阻碍作用"],"answer":"B","analysis":"经济基础决定法，法对经济基础有反作用（服务、确认、引导）。","isKey":false},
  {"id":"jur-042","chapter":5,"stem":"引起法律关系产生、变更和消灭的客观情况是：","options":["A.法律规范","B.法律事实","C.法律行为","D.法律事件"],"answer":"B","analysis":"法律事实是能够引起法律关系产生、变更和消灭的客观情况或现象。","isKey":true},
  {"id":"jur-043","chapter":6,"stem":"责任相当原则是指：","options":["A.谁违法谁负责","B.法律责任由法律规定","C.责任大小与违法行为程度相适应","D.行为与结果有因果关系"],"answer":"C","analysis":"责任相当原则是指法律责任的大小与违法行为的程度相适应。","isKey":true},
  {"id":"jur-044","chapter":7,"stem":"联系其他条文进行解释的方法是：","options":["A.文义解释","B.体系解释","C.历史解释","D.目的解释"],"answer":"B","analysis":"体系解释是联系其他条文进行解释，保持法律体系的统一性。","isKey":true},
  {"id":"jur-045","chapter":8,"stem":"在法律规定不明确时使用的推理是：","options":["A.形式推理","B.实质推理","C.演绎推理","D.归纳推理"],"answer":"B","analysis":"在法律规定不明确或存在矛盾时，需要使用实质推理（辩证推理）。","isKey":true},
  {"id":"jur-046","chapter":9,"stem":"法律至上原则是指：","options":["A.法律具有最高权威","B.领导具有最高权威","C.权力具有最高权威","D.道德具有最高权威"],"answer":"A","analysis":"法律至上原则是指法律具有最高权威，任何组织和个人都不得凌驾于法律之上。","isKey":true},
  {"id":"jur-047","chapter":10,"stem":"自由是法律的：","options":["A.基础价值","B.核心价值","C.次要价值","D.附属价值"],"answer":"B","analysis":"自由是法律的核心价值，法律是自由的保障。","isKey":true},
  {"id":"jur-048","chapter":3,"stem":"法的起源的一般规律不包括：","options":["A.从个别调整到规范性调整","B.从习惯到习惯法再到成文法","C.从与道德混合到相对独立","D.从成文法到习惯法"],"answer":"D","analysis":"法的起源规律是从习惯到习惯法再到成文法，不是从成文法到习惯法。","isKey":true},
  {"id":"jur-049","chapter":1,"stem":"确定性规则、委任性规则与准用性规则的分类标准是：","options":["A.规则的内容规定","B.规则的确定性程度","C.规则的强制性程度","D.规则的适用范围"],"answer":"B","analysis":"按照规则的确定性程度不同，法律规则分为确定性规则、委任性规则和准用性规则。","isKey":false},
  {"id":"jur-050","chapter":9,"stem":"法治与人治的根本区别是：","options":["A.是否有法律","B.法律是否具有最高权威","C.是否有执法机关","D.是否有立法机关"],"answer":"B","analysis":"法治与人治的根本区别在于法律是否具有最高权威。法治强调法律至上，人治强调个人权威。","isKey":true},
  {"id":"jur-051","chapter":6,"stem":"法律责任的构成要件不包括：","options":["A.违法行为","B.损害结果","C.主观过错","D.违法动机"],"answer":"D","analysis":"法律责任的构成要件包括主体、违法行为、损害结果、因果关系、主观过错，不包括违法动机。","isKey":false},
  {"id":"jur-052","chapter":2,"stem":"守法的主体是：","options":["A.公民个人","B.国家机关","C.一切国家机关、社会组织和公民","D.司法机关"],"answer":"C","analysis":"守法的主体是一切国家机关、社会组织和全体公民。","isKey":true}
]
